id,description,likes,comments,shares,views,authorDataId,authorFollowers,authorFollowing,location,createdAt,updatedAt
463780,"Começa hoje a vacinação contra a Influenza em Aracaju. Neste primeiro momento, serão prioridade as crianças acima dos 6 meses e abaixo dos 6 anos,  gestantes, professores e trabalhadores da saúde. Para se vacinar, basta ir a uma das UBS ou aos postos de vacina nos shoppings.",1,1,0,0,116835,0,0,,2025-05-23 01:10:32.546,2025-05-23 01:10:32.546
463781,"💉 Boas notícias! Aracaju e maioria dos municípios sergipanos iniciaram a vacinação contra a covid-19 em crianças de 3 e 4 anos hoje. Quem tem 3 anos de idade é preciso que sejam imunossuprimidas, com comorbidades ou deficiência permanente. Crianças com 4 anos, não há restrição.",1,0,0,0,72916,0,0,,2025-05-23 01:10:50.269,2025-05-23 01:10:50.269
463817,O Brasil e SC registraram hoje mais um recorde trágico dessa pandemia. Foram 3 mil e 251 mortes nas últimas 24h. Inadmissível! Precisamos de vacinação em massa com urgência e no curto prazo. Só assim poderemos vencer essa batalha.,4,4,0,0,69573,0,0,,2025-05-23 02:41:17.607,2025-05-23 02:41:17.607
463854,"@CimentoCone O Dr Maria Emília gadelha,fala que a coronavac tem 4x mais alumínio que o permitido em vacinas !Um dos efeitos adversos de metais pesados no organismo são problemas neurológicos 😔",1,1,0,0,1523,26,18,,2025-05-23 03:19:42.498,2025-05-23 03:19:42.498
463856,ta louco a vacina da gripe quebrou os guri,1,1,0,0,131845,78,104,,2025-05-23 03:20:20.370,2025-05-23 03:20:20.37
463868,"RT @fabiofaria5555: Matéria de hoje do NYTIMES: ""Brasil é o 1º país dos BRICS e o 2º país da América Latina com MAIS doses de vacina contra…",0,0,2600,2600,70018,0,0,,2025-05-23 03:26:49.721,2025-05-23 03:26:49.721
463876,"MALÁRIA I Com quase 118 mil casos registrados no Brasil em 2023, imunizante Vivaxin apresenta resultados promissores na fase pré-clínica. #usp #malaria #vacina #vacinacao #cura #doenças #foz https://t.co/LsjxQrXjBU https://t.co/VxIODzvrPv",1,0,1,1,21246,306,1625,Foz do Iguaçu - PR,2025-05-23 03:34:18.732,2025-05-23 03:34:18.732
463877,Es Sra Criminal debe ser presa de inmediato #PFIZERGATE @vonderleyen,0,0,0,0,3854,399,2223,Republica Dominicana/España.EU,2025-05-23 03:35:39.327,2025-05-23 03:35:39.327
463881,🇧🇷💉Brasil avança em testes de vacina totalmente nacional contra Covid-19https://t.co/2baMeKVoPb,67,4,13,13,14159,7949,8,,2025-05-23 03:36:53.562,2025-05-23 03:36:53.562
463885,@BlogPequi Agora temos as vítimas das Vax experimental,1,0,0,0,14883,815,1370,,2025-05-23 03:38:55.626,2025-05-23 03:38:55.626
463906,OBRIGADO MEU QUERIDO MDS OBRIGADO descobrindo agora que quem toma prep pode se vacinar pra hepatite A pelo SUS mds viva as cuneteiras viva o sus viva dr ricardo kores 😭😭😭😭,2,1,0,0,131792,671,629,thanagar,2025-05-23 03:48:19.071,2025-05-23 03:48:19.071
463910,"quando eu sou ""fala assim de novo que eu corto seu saco no canivete enferrujado pra voce ficar sem ovo e com tetano seu filho da puta"" e elas sao ""eu n gostei desse tom q vc usou cmg amor ://"" (eu claramente perdi",5,0,0,0,131796,604,288,no inferno,2025-05-23 03:51:48.139,2025-05-23 03:51:48.139
463911,Alex um tonto que conseguiu colocar as impressões digitais dele numa arma de crimeClear morreu pq tava toda preocupada com um cara que conheceu ontem Wendy só começou a se mexer pq o Kevin alertou ela sobre os acidentes anteriores Kimberly rainha,3,0,0,0,131303,3863,2194,Belém,2025-05-23 03:51:54.102,2025-05-23 03:51:54.102
463923,"Dnv essas crianças desgraçadas fazendo barulho. Juro, cadê o sarampo ??????",1,0,0,0,81059,785,522,Belo Horizonte-MG,2025-05-23 04:00:36.494,2025-05-23 04:00:36.494
463931,Aonde isso foi chegar hen ? Chupa meningite 🖕🏼🖕🏼,1,0,0,0,131804,44,169,,2025-05-23 04:06:50.152,2025-05-23 04:06:50.152
463950,"É uma preocupação mundial, mas até hoje as instituições fingem que pandemia acabou e covid não é mais uma ameaça. No Brasil, a maioria da população não tem direito mais à vacina, e o número de doses compradas com atraso pra prioritários é insuficiente ¯\_(ツ)_/¯",21,0,9,9,9041,295,1542,Belo Horizonte,2025-05-23 04:16:10.040,2025-05-23 04:16:10.04
463953,"Diego Ribas foi para a Ilha Grande (RJ) passar 3 dias, em 2020. A pandemia da Covid eclodiu, foi decretado fechamento geral da região justamente neste período e o isolamento inesperado fez com que o ex-Fla criasse raízes eternas com uma vila de pescadoreshttps://t.co/aHpW41heG3",5,0,0,0,12273,32107,2282,Rio de Janeiro - Brasil,2025-05-23 04:19:03.619,2025-05-23 04:19:03.619
463960,a gripe mais rápida de todos os tempos (graças a deus,1,0,0,0,131850,824,702,,2025-05-23 04:28:26.156,2025-05-23 04:28:26.156
463965,"Oropouche: Colatina registra a primeira morte do ES em 2025 [ https://t.co/zdWqn5OiFo ]Secretaria de Estado da Saúde (Sesa) disse que a vítima é um homem de 52 anos, com histórico de hipertensão e cardiopatia; morte ocorreu no dia 16 de janeiro https://t.co/tXmWZSvxoV",2,0,0,0,8141,443243,150,Vitória - ES - Brasil,2025-05-23 04:31:15.779,2025-05-23 04:31:15.779
463967,um dia vou pra Índia e fazer a coreografia de Kajra re da novela caminho das indias na frente do taj mahal,8,1,1,1,131851,461,509,7x1,2025-05-23 04:31:54.918,2025-05-23 04:31:54.918
463968,Mds a coisa q eu mais amo eh conhecer gente,1,0,0,0,131823,30,30,,2025-05-23 04:33:34.496,2025-05-23 04:33:34.496
464032,"ARQUIVAMENTO | O ministro Alexandre de Moraes, do STF determinou nesta sexta-feira (28) o arquivamento do inquérito que investigou o ex-presidente Jair Bolsonaro pela suposta falsificação de cartões de vacinação contra covid-19. Leia mais: https://t.co/HxI11tjHI8. https://t.co/ORmuqb4FIX",2,0,0,0,5908,0,0,,2025-05-23 07:07:25.351,2025-05-23 07:07:25.351
464037,"Há 120 anos, uma lei federal tornou a vacinação obrigatória em todo o país. E isto foi a gota d’água para a Revolta da Vacina, uma confusão que marcou a história da então jovem República: https://t.co/KxEKcLG8Ju#ArquivoBBC https://t.co/hDsD9jMp8H",86,1,15,15,11752,3363502,838,,2025-05-23 07:12:49.077,2025-05-23 07:12:49.077
464044,"🏙️Brasilienses vão aos postos de saúde em busca da vacina contra a gripe; sem filasA campanha contra a gripe foi ampliada para todos os públicos, a partir dos seis meses de idade.https://t.co/wUgvE8FFzF",4,0,2,2,837,886937,121,,2025-05-23 07:26:24.834,2025-05-23 07:26:24.834
464046,Pfizer anuncia acordo de US$ 6 bilhões com chinesa 3SBio para desenvolver medicamento contra câncer➡️Possível medicamente atualmente está em fase de ensaios clínicoshttps://t.co/meIqHT27bT,0,0,0,0,354,7500,31,,2025-05-23 07:27:10.096,2025-05-23 07:27:10.096
464053,Saúde em BH: retomada da vacinação contra dengue tem baixa procura.https://t.co/Z6VZI2DT2X,4,0,0,0,1422,0,0,,2025-05-23 07:39:39.935,2025-05-23 07:39:39.935
464083,Começa vacinação 2015 contra Febre Aftosa em Mato Grosso do Sul http://t.co/dLZ4P4Ne1v #Idest,0,0,0,0,68480,0,0,,2025-05-23 08:11:13.749,2025-05-23 08:11:13.749
464086,Anvisa interdita creme dental da Colgate após reações adversas ao uso https://t.co/asRDyDdzkN(Foto: Reprodução) https://t.co/PHX5uWMRIp,5,0,0,0,5831,0,0,,2025-05-23 08:12:43.591,2025-05-23 08:12:43.591
464093,Covid-19: vacinação de idosos será ampliada em junho no Rio https://t.co/CNIjIxhsZz #RiodeJaneiro #ODia,2,0,0,0,883,914729,123,,2025-05-23 08:22:08.332,2025-05-23 08:22:08.332
464095,"São Paulo vai ampliar campanha de vacinação contra gripe a partir de segunda, 19 https://t.co/q2PbNbQgWj #MeiaHora",0,0,0,0,4800,98640,5490,,2025-05-23 08:23:09.136,2025-05-23 08:23:09.136
464102,Dia D de vacinação contra a gripe será no sábado (10) em São Luíshttps://t.co/ZMsD6pGraP,0,0,0,0,77789,35236,60,,2025-05-23 08:33:04.956,2025-05-23 08:33:04.956
464109,Já se imunizou? GDF libera vacina contra a gripe para toda a população a partir desta semana https://t.co/DOrQhtBmWV #PortaliG #UltimoSegundo,0,0,0,0,9453,120618,2566,,2025-05-23 08:44:54.267,2025-05-23 08:44:54.267
464121,"💉 Vacinação contra a gripe é ampliada para toda a população da cidade de São Paulo #sbtnewsObjetivo é conter o avanço das doenças respiratórias durante o outono e o inverno, períodos com maior circulação de vírus; veja como se prevenirhttps://t.co/R5DS3xvgS2",2,1,0,0,5187,589809,165,,2025-05-23 09:00:35.841,2025-05-23 09:00:35.841
464129,"Campanha nacional de vacinação contra a gripe começa nesta segunda-feira (7), confira os locais em Natalhttps://t.co/38Avs5qOYx",0,0,0,0,68489,0,0,,2025-05-23 09:12:35.354,2025-05-23 09:12:35.354
464163,RT @GloboNews: .@NatuzaNery traz apuração sobre o caso do inquérito dos cartões falsos da vacina da Covid no governo Bolsonaro. Fontes dize…,0,0,20,20,74552,0,0,,2025-05-23 09:56:29.950,2025-05-23 09:56:29.95
464256,Vacina pra fungo em um ambiente pós apocalíptico sem estudo ou os equipamentos necessários https://t.co/G6tfA3MlE9,17,1,1,1,34240,37,48,𐔌  ᩙ   ᦏ♡᪔  ໒꒱,2025-05-23 13:46:51.829,2025-05-23 13:46:51.829
464268,Hackney Books Afternoon Headlines&gt; Pfizergate EU Commission Guilty&gt; Hackney Man Hit By Lorry Fights For Life&gt; Kent Dentist Extraction Broke Woman's JawRead All About Ithttps://t.co/wjYpit6U1JAll Free All The Time#HackneyBooks #Pfizergate #StokeNewington #KentDentist https://t.co/nIEKbifMZE,1,0,0,0,131867,1275,1186,Hackney,2025-05-23 13:57:31.208,2025-05-23 13:57:31.208
464273,"@licamedeiros @minsaude Obrigada por resistir e continuar esta luta inglória. É desesperador. Na última segunda tomei as duas vacinas (Covid e influenzae). Na fila (campanha) muitas pessoas mais jovens reclamando que não tem mais vacina da Covid pra eles. As pessoas querem se vacinar, mas não tem vacina",5,1,0,0,8908,159,284,"São Paulo, Brasil",2025-05-23 14:02:58.201,2025-05-23 14:02:58.201
464304,"@ocirurgiao eu tive herpes zoster e tive que repor tbm, residência é um lugar desumano",15,0,0,0,111008,2272,421,,2025-05-23 14:30:36.664,2025-05-23 14:30:36.664
464305,"@carinatc_ @_alannne É verdade. Tive uma vizinha que o filho chorava 24h por dia. Certo dia fui lá e perguntei se ela queria ajuda, ela disse: se vc puder fazer ele se calar, me ajudaria,pfv faz ele se calar!Eu sugeri levar ao médico,pq n era normal.Resultado: meningite, o bebê faleceu após 1 semana.",2,1,0,0,25421,197,262,Brasília,2025-05-23 14:33:22.327,2025-05-23 14:33:22.327
464310,"@promptCol @RobertoZeballo7 Ah , sim legal. E se for fatal.Com certeza não fará a segunda dose.Engraçado que, somente a vacina do COVID que está tendo repercussão.Pois conheço pais que não querem a vacina de rotina como a  HPV.Mas não tiveram passaporte presos ou multa. Estranho, né?",1,1,0,0,131877,38,156,,2025-05-23 14:36:24.901,2025-05-23 14:36:24.901
464316,"@filipe_rafaeli Eu não tomei nenhuma dose de vacina, não deixei de sair para caminhar na praia e usei o kit preventivo . Não tive covid nem gripe no periodo",8,0,0,0,131880,20,104,,2025-05-23 14:40:46.394,2025-05-23 14:40:46.394
464320,"@br__paty @filipe_rafaeli A thread de @filipe_rafaeli aponta que o imprinting imunológico pode reduzir a eficácia das vacinas contra COVID-19 para novas variantes, citando um estudo de maio de 2025. O estudo da Communications Medicine confirma que o imprinting ocorre, mas a vacina XBB.1.5 ainda aumenta… https://t.co/ptDxi3Bjvg",8,3,0,0,128140,1938636,2,wherever you are,2025-05-23 14:45:46.166,2025-05-23 14:45:46.166
464324,"@jiyonggirlfrnd KAKAKAKAKAK ai amg traumatizei de sp pq eu fui ai em abril e ate gostei mas qndo eu volyei peguei a pior gripe da minha vida e até hj, um mes e meio dps, to meio rouca, essa cidade me amaldiçoou ainda bem q passei longe de guarulhos 🙏 (to brincand",1,0,0,0,131886,2702,6858,,2025-05-23 14:50:28.519,2025-05-23 14:50:28.519
464325,"Eh impressao minha ou todo mundo ta c dengue? Inclusive eu, pela segunda vez 🤡",27,5,1,1,131887,15028,675,"Porto Alegre, Brasil",2025-05-23 14:50:43.693,2025-05-23 14:50:43.693
464329,cê só conhece o que eu falo e eu nem falo sobre tudo,2,0,1,1,131281,152,138,purplewrld,2025-05-23 14:52:32.445,2025-05-23 14:52:32.445
464343,Prefeitura de Aparecida leva vacinação para adultos em terminais de ônibus. Veja o cronograma https://t.co/GnWbAf7NUE https://t.co/eD2jHuCTkP,2,0,0,0,609,0,0,,2025-05-23 15:50:02.939,2025-05-23 15:50:02.939
464348,"Apesar de recomendação do Ministério da Saúde, faixa etária para vacina contra a dengue não será ampliada no AC ==&gt; https://t.co/nnUU4UV4d9 #g1AC https://t.co/ts63QZdV2H",0,0,1,1,68698,0,0,,2025-05-23 16:05:02.691,2025-05-23 16:05:02.691
464350,"Arthur Lira diz que 'caso não haja base científica"", Bolsonaro ""vai pagar"" pela associação inverídica entre vacina contra Covid-19 e Aids.https://t.co/Iq01Li2LIU Pagar como? Com um dos pedidos de impeachment? #brpressconteudo #AIDS #covi19 Foto: Marcelo Camargo/Agência Brasil https://t.co/xn8vrfpJPH",0,0,0,0,68699,0,0,,2025-05-23 16:05:27.921,2025-05-23 16:05:27.921
464368,"Shoppings de Belém ofertam vacinação contra a gripe neste sábado, 25https://t.co/P1mDZrteLR #g1para",1,0,0,0,5622,0,0,,2025-05-23 16:42:01.466,2025-05-23 16:42:01.466
464393,"Veja como se proteger da covid-19 no invernoMesmo com impacto menor da doença neste ano, vacinação segue importantehttps://t.co/XzHKCyYVOU",0,0,0,0,611,446811,131,,2025-05-23 17:16:47.373,2025-05-23 17:16:47.373
464406,"➡️Casos de gripe disparam no país e baixo nível de vacinação preocupa especialistasVírus influenza tipo A provoca aumento nas internações, principalmente entre crianças e idosos. Ao todo, 15 estados já estão em alerta #sbtnews https://t.co/Q0Kt3wXm5S https://t.co/8OSwTEF0cq",2,0,0,0,5187,589809,165,,2025-05-23 17:38:08.551,2025-05-23 17:38:08.551
464412,RT @g1tvintegracao: MPF pede que pacientes em Uberlândia recebam tratamento precoce para Covid-19 e que Prefeitura compre vacinas https://t…,0,0,1,1,68956,0,0,,2025-05-23 17:49:31.653,2025-05-23 17:49:31.653
464588,RT @BandJornalismo: Fiocruz oficializa pedido para produzir vacina contra dengue no Brasil #BandJornalismo https://t.co/Rx5bAcY94x,0,0,3,3,77064,0,0,,2025-05-23 22:15:45.961,2025-05-23 22:15:45.961
464598,COVID-19| A Anvisa recebeu do Instituto Butantan dados adicionais sobre o pedido de autorização da vacina CoronaVac para crianças de 3 a 5 anos de idade.#CBNmaceió #cbnmaceió #Alagoas #Jornalismo #notícia #anvisa #vacina #CoronaVac #crianças #pandemia https://t.co/8lv9fFw0Oe,0,0,0,0,68620,0,0,,2025-05-23 22:27:34.914,2025-05-23 22:27:34.914
464608,💉 Mauá libera vacina da gripe para todos a partir dos 6 meses Leia: https://t.co/wGAFZNQEAu,0,0,0,0,14340,0,0,,2025-05-23 22:35:35.500,2025-05-23 22:35:35.5
464611,"TRATAMENTO PARA AME | Pela primeira vez, o SUS aplicou um dos remédios mais caros do mundo usado para o tratamento de crianças com Atrofia Muscular Espinhal (AME). O Zolgensma, primeira terapia gênica incorporada ao SUS, custa em média R$ 7 milhões por dose. https://t.co/nSwLsU6zGX",15,2,8,8,1441,0,0,,2025-05-23 22:41:12.843,2025-05-23 22:41:12.843
464612,Metrô BH promove vacinação contra gripe nesta quarta-feira (21/5)https://t.co/YqQosQvNdB,3,0,0,0,1422,0,0,,2025-05-23 22:43:48.227,2025-05-23 22:43:48.227
464662,Temporada dos vírus respiratórios se aproxima e Saúde alerta para importância da vacinação https://t.co/7TMJjGy3im,0,0,0,0,14654,27003,753,,2025-05-23 23:30:30.260,2025-05-23 23:30:30.26
464665,"@GrecoNewton @schmittpaula ""O câncer (...) como o de Adams, é uma condição complexa influenciada por fatores como idade (...), genética, estilo de vida e outros fatores ambientais, mas não há estudos confiáveis que associem vacinas de mRNA a esse tipo de doença.""O tom de voz não se refere à vacina.Grok",0,2,0,0,131910,339,894,Brazil,2025-05-23 23:33:01.846,2025-05-23 23:33:01.846
464723,🤦🏻‍♂️🇧🇷Governo Lula incinera quase 11 milhões de vacinas vencidas. #Brasil #vacina #Lula #gorveno https://t.co/h5pjBAU4FS,0,0,0,0,77526,4,125,brasil,2025-05-24 00:32:18.200,2025-05-24 00:32:18.2
464724,@ZDFheute @vonderleyen rattrapée par le #pfizerGate 🤣👍🏻,0,0,0,0,131914,3515,3937,Suisse ,2025-05-24 00:32:32.115,2025-05-24 00:32:32.115
464726,@mentoramaDev @zorakbr O vídeo parece ser fake mesmo. Mas na região sul tem vários casos de autoritarismo estatal ameaçando país a vacinarem seus filhos com vacina de covid  (terapia genica). Brasil. Único país do mundo obrigando crianças a se vacinarem com mrna,1,0,0,0,75317,29,143,,2025-05-24 00:34:56.052,2025-05-24 00:34:56.052
464728,"O FDA americano acabou de restringir acesso a vacina de COVID pra pessoas acima de 65 anos, não sei quem vai lucrar com isso, a maioria dos fundos de pensão lá são privados, não lembro se existe aposentadoria pública, outras variantes da COVID poderão causar mortes em idosos.",4,1,1,1,12947,3175,1394,"Campinas, SP ",2025-05-24 00:38:09.169,2025-05-24 00:38:09.169
464734,"@karenllyandra Está acontecendo em todo o Brasil, moro em Fortaleza mas no meu interior aqui no Ceará estão com campanha de vacinação e pedindo autorização pra vacinar as crianças na escola, dizem que é pra regularizar o calendário vacinal e adivinha a vacina da COVID está no calendário de",16,0,4,4,3110,1498,2609,,2025-05-24 00:40:29.712,2025-05-24 00:40:29.712
464735,"Crianças e adolescentes que receberam pelo menos uma vacina COVID-19 tiveram um risco 23% maior de desenvolver doença auto-imune do as não vacinadas, de acordo com um novo estudo revisado por pares.https://t.co/nGKl9TjzXN",2,0,1,1,15968,2048,239,,2025-05-24 00:40:30.323,2025-05-24 00:40:30.323
464739,omg marquinha da vacina bcg hiii https://t.co/xQFbLDv84Q,12,1,0,0,131871,630,685,vila belmiro,2025-05-24 00:41:16.030,2025-05-24 00:41:16.03
464742,vsf esse cara se eu tivesse mesmo com tuberculose ele tava fudido https://t.co/pNVuVyewdO,4,0,0,0,131870,58,249,"SOAD Interlagos, 2025",2025-05-24 00:43:51.044,2025-05-24 00:43:51.044
464743,Fui me vacinar num PSF em Cuiabá nesta semana e logo na porta da sala de vacinação tinha um A4 colado com a lei sobre desacato a servidores públicos. Sintomático.,1,0,0,0,114255,0,0,,2025-05-24 00:43:53.082,2025-05-24 00:43:53.082
464751,"esses tipos de comentário me tiram uma gargalhada tão genuína, eu tô rindo tanto disso kkkkkkkkkkkkkkkk",3,0,0,0,131303,3863,2194,Belém,2025-05-24 00:49:34.129,2025-05-24 00:49:34.129
464762,"Desde a noite da segunda-feira ~fiquei mal~ e eu não sabia que era possível um corpo de 1,64 vomitar tanto, além da diarreia e febre, né, porque o vírus serve no combo estilo batata + bebida. Rotavírus, nem sei o que te dizer, sabe, apenas humilhe menos. Bom dia, tô viva.",6,2,0,0,131915,2214,293,Maceió/AL,2025-05-24 00:55:28.621,2025-05-24 00:55:28.621
464764,"@Edson04415858 @zorakbr Tem que tomar vacina sim!!! Não essas do COVID. A tríplice viral, a febre amarela, a do tétano são super importantes na vida de todos",7,2,0,0,131874,76,38,Spain,2025-05-24 00:55:49.046,2025-05-24 00:55:49.046
464768,tenho mt odio de nunca ter pego catapora drxE EU TENTEI PEGAR QUANDO CRIANÇA agr se pego depois de adulta pode até matar,1,2,0,0,131876,158,170,091,2025-05-24 00:59:20.131,2025-05-24 00:59:20.131
464780,"@Fabiocese @jslocutor @Doutrinadorg Revisão Sistemática de Popp et al. (2022): Uma revisão sistemática publicada no Cochrane Database Systematic Review analisou a ivermectina para prevenção e tratamento da COVID-19. Embora o foco principal tenha sido a falta de eficácia contra o SARS-CoV-2, o estudo mencionou… https://t.co/zRCOU71RpC",3,1,0,0,119680,140,36,"Belo Horizonte, Brazil",2025-05-24 01:11:01.249,2025-05-24 01:11:01.249
464785,"@godzillababy33 Essa linhagem de cientista depois tentou aplicar sobre o aquecimento global, sobre covid do morcego e que vacina fast food salva vidas.",2,0,1,1,77748,34,235,,2025-05-24 01:17:06.100,2025-05-24 01:17:06.1
464790,"@CarolDeToni Socióloga?Onde ela se formou? Não encontrei o Lattes dela pra ver publicações, artigos.... Não existe nada.Ela comprou o diploma de graduação em sociologia?",1,0,0,0,35958,71,396,,2025-05-24 01:22:52.197,2025-05-24 01:22:52.197
464842,"Falei isso há quase dois anos atrás, devíamos ter encontrado uma forma de vacinar os animais marinhos e as aves ANTES de do H5N1 ter se espalhado, agora os países estão com o protecionismo vacinal, cada um vacina sua própria população, ignoram q o vírus evolui sobretudo nas⬇️ 1/2",24,1,3,3,12947,3175,1394,"Campinas, SP ",2025-05-24 03:13:17.428,2025-05-24 03:13:17.428
464845,@CCallaicus @oqtiverqser Esta calado monte de merda ovelha do caralho e vai levar a tua dose de reforço de 2025 💉🐑,1,1,0,0,131862,183,650,"Lisboa, Portugal",2025-05-24 03:13:39.007,2025-05-24 03:13:39.007
464846,@Leandro09011650 @Guthbsb Lula com 14 containers que saíram do planalto tudo ok?Joias do Bozo rende!Ministros do nine vários não vacinaram.....inclusive a ministra da saúde...piada vcs,4,0,0,0,131863,2,47,,2025-05-24 03:13:51.265,2025-05-24 03:13:51.265
464848,"@amand4sarment0 Eu idem, antes de viajar pro RJ me vacinei também",3,1,0,0,29028,457,3095,"Ratanabá, Amazônia",2025-05-24 03:16:05.366,2025-05-24 03:16:05.366
464849,@Murilo226655 @eujeromino @filipe_rafaeli Meu ciclo familiar e amigos foram oito que tomaram as vacinas e morreram. O último foi meu cunhado que tomou AstraZeneca ( que foi  suspensa a  produção no mundo todo ) pegou COVID e  1 semana depois morreu.  O que enfraqueceu o vírus foi  imunidade natural que muitos ignoraram,3,0,0,0,74840,21,81,,2025-05-24 03:16:05.368,2025-05-24 03:16:05.368
464850,"🇺🇲🚨 RELATÓRIO: O Dr. Peter McCullough afirma ter visto apenas DOIS casos de miocardite em toda a sua carreira antes da C*VID.Depois que as v*cinas foram lançadas, tudo mudou.Ele afirma ter ""examinado milhares de pacientes com esse problema"".""Há 1.065 artigos na literatura https://t.co/SsSQan5SdZ",108,3,38,38,84938,4152,4077,"Florida, USA",2025-05-24 03:16:17.654,2025-05-24 03:16:17.654
464851,$PFE Pfizer Ltd #India Q4 results: Net profit jumps 85% to Rs 330.94 crore https://t.co/uvs2QVaz7Y a través de @timesofindia,1,0,0,0,131864,1101,170,España,2025-05-24 03:16:47.932,2025-05-24 03:16:47.932
464852,@RobertoZeballo7 Como debater injetar mRNA em alguém com quem não sabe responder nem qual é a função do ribossomo numa célula?,3,0,0,0,4631,83,53,,2025-05-24 03:17:00.594,2025-05-24 03:17:00.594
464854,"@sigewinnecharts E que as vezes o óbvio tem que ser dito,viram como o bb reborne se espalhou, isso foi falta de um tapa na cara da realidade",1,1,0,0,185,130,2135,,2025-05-24 03:18:56.331,2025-05-24 03:18:56.331
464855,"Catástrofe silenciosa: vacinas contra a COVID-19 estão associadas à queda nas taxas de fertilidade, revelam dados tchecos...Vários estudos mostram que a proteína spike ela se acopla nos ovários e também nos homens nos testículoshttps://t.co/Jb0xbYTZYdhttps://t.co/1H74x8Ckaq https://t.co/c24YlSPRXb",8,1,0,0,3283,3169,6794,"Orlando, FL",2025-05-24 03:19:02.282,2025-05-24 03:19:02.282
464859,@karinamichelin Uma nova fraudemia. Será que combinaram com os Russos ? Será que o povo vai cair de novo ?,3,1,1,1,11056,1398,1810,,2025-05-24 03:19:36.651,2025-05-24 03:19:36.651
464873,"O Acordo prevê ações para reduzir as desigualdades no acesso à saúde, fortalecer a produção local, proteger os trabalhadores da saúde e os grupos historicamente marginalizados, como povos indígenas, pessoas com deficiência e populações em situação de vulnerabilidade.",14,2,4,4,228,1338829,321,"Brasil, Brasília",2025-05-24 03:29:33.439,2025-05-24 03:29:33.439
464875,"@Doutrinadorg Eu e minha esposa tomamos 1 vez por mês 3 piulas cada desde 15/03/2020. Desde então nunca mais ficamos gripados . Deve ser sorte .Ps.: Nosso DNA esta intacto, não tomamos a vachina.",68,7,3,3,131921,60,813,Por ai,2025-05-24 03:32:32.541,2025-05-24 03:32:32.541
464876,"Ora bem... Ele ""obrigou"" os Galegos a levar a terapia genética, sob pena de coimas elevadasSerá  que tbém as levou?",1,0,0,0,1967,163,191,,2025-05-24 03:32:32.671,2025-05-24 03:32:32.671
464878,"@kleriene18 Vc recomenda um idoso tomar a vacina da pneumonia? Pergunto pq minha avó teve 2x ano passado pneumonia, e no posto nao tem, estava pensando em pagar pra ela, melhor a vacina da pneumonia ou a da gripe ou as duas num período de 30 dias ou nenhuma? Obrigada",1,3,0,0,131868,18,233,"São Paulo, Brasil",2025-05-24 03:33:16.926,2025-05-24 03:33:16.926
464880,"@enf_intensiva Sou a favor das vacinas. Mas lendo alguns comentários e vendo a reação dos pais por negarem a vacina. Sou da seguinte opinião, se a criança viesse a óbito por alguma doença, que poderia ser evitada. Os pais teriam que ser presos até o último dia de suas vidas.",7,0,0,0,131869,902,1488,,2025-05-24 03:35:36.223,2025-05-24 03:35:36.223
464881,os vagalumes colocando um vídeo no youtube amanhã “Como fazer vacina com papel machê e adolescente morta”,2,0,0,0,131777,6614,1108,"São Carlos, Brasil",2025-05-24 03:35:47.432,2025-05-24 03:35:47.432
464882,"No Brasil, a vacina 4CMenB está disponível apenas na rede privada, com preços variando entre R$ 650 e R$ 1.440 para o esquema completo. Atualmente, não há previsão de incorporação ao SUS para adultos.",64,2,2,2,9243,122319,910,"São Paulo, Brasil",2025-05-24 03:36:20.311,2025-05-24 03:36:20.311
464888,"@sctyahoo @tiagosimoens Vc deve ter hpv, 90% da população tem, a menos que tenham sido vacinados antes se fazerem sexo. Existem IST que se pegam na garganta tbm. Hepatite se pega no sexo oral. Tá vendo que ngm está livre? Ou 100% livre?",1,1,0,0,131922,21027,52,,2025-05-24 03:39:47.869,2025-05-24 03:39:47.869
