id,description,likes,comments,shares,views,authorDataId,authorFollowers,authorFollowing,location,createdAt,updatedAt
470155,"@tem_que_dizer E para os agricultores do Sul, Nada. E se você estiver doente e precisar do SUS, ou tratamento alternativo para um filho, entre na Justiça.",1,0,0,0,132302,14,125,,2025-05-29 11:58:03.192,2025-05-29 11:58:03.192
470157,Fui pegar medicamento na Farmácia e de quebra tomei vacina da gripe e atualizei meu cartão. Bom demais ser brasileiro. Viva o SUS,4,2,0,0,100775,169,56,"Uberlândia, Brasil",2025-05-29 11:58:13.856,2025-05-29 11:58:13.856
470158,"A realidade de quem depende do SUS é marcada por longas filas de espera, falta de medicamentos, hospitais superlotados e profissionais exaustos, muitas vezes trabalhando sem os recursos adequados. Diariamente, milhares de brasileiros perdem suas vidas ou têm sua saúde agravada",6,0,3,3,2339,7858,7555,,2025-05-29 11:58:19.076,2025-05-29 11:58:19.076
470159,"@Lordnewsbrasil O médico pediu exame de sangue mas não consigo retorno eles não chamam (sus) .Consegui no clínico o meu exame pelo q li o normal acho q era 800  não estava chegando nem a 300  pela minha idade ela  disse q está ok ,mas sinto q estou  mal ,não tenho mais a energia de antes",1,1,0,0,132304,42,267,,2025-05-29 11:58:24.579,2025-05-29 11:58:24.579
470160,"Como sabem, resido em cidade 6 mil habitantes.  Ao ter um pico de pressão novamente, me foi pedido vários exames desde o dia 04 passado. Estou me dando ao trabalho de documentar O QUE É O SUS. Creio q 6 mil habitantes e td o abusrdo...vai ESPELHAR a realidade Após o dia 12 posto.",2,1,0,0,132305,384,345,RS,2025-05-29 11:58:30.217,2025-05-29 11:58:30.217
470161,"@polaarinen @candydimaury mas serio agora: ele defendendo educacao publica e saude publica (SUS) me pega de um jeito… me formei em universidade federal, trabalho no SUS desde então, e em hospital universitário há uns 9 anos… não dá pra amar mais esse homem!",7,1,0,0,76959,652,2032,Cidade Maravilhosa,2025-05-29 11:58:37.048,2025-05-29 11:58:37.048
470163,"@emirsader @zehdeabreu Parabéns Nisia , a voce e a todos da Fiocruz, especialmente minha amiga Dra. Angela",12,0,1,1,132306,243,285,"São Paulo, Brasil",2025-05-29 11:58:48.485,2025-05-29 11:58:48.485
470165,"@fearless_202 @RosliaSilvanaM1 @HONMART @rennatodutra Durante o governo Bolsonaro (2019-2022), o Brasil enfrentou retrocessos em várias áreas. O desmatamento na Amazônia cresceu 72%, com 11.568 km² perdidos em 2020, devido à redução de proteções ambientais. A resposta à COVID-19 foi criticada por minimizar a pandemia, promovendo… https://t.co/wLJMlfhGYi",4,0,0,0,128140,1938636,2,wherever you are,2025-05-29 11:59:02.823,2025-05-29 11:59:02.823
470171,RT @AfpChecamos: Este estudo mostra que o risco de miocardite é cinco vezes maior após a vacinação do que após a #COVID19?❌ Falso. O arti…,0,0,6,6,16509,0,0,,2025-05-29 12:02:24.315,2025-05-29 12:02:24.315
470175,Rússia e outros países diminuem restrições à carne de frango brasileira por gripe aviáriahttps://t.co/wUiFnzp7TN,13,1,7,7,889,689140,710,,2025-05-29 12:03:29.389,2025-05-29 12:03:29.389
470183,Fávaro afirma que gripe aviária é oportunidade para mostrar robustez do sistema➡️Ministro afirma que vírus demorou para entrar no plantel comercial brasileirohttps://t.co/7pNyL8WZIV,0,0,0,0,354,7500,31,,2025-05-29 12:05:31.151,2025-05-29 12:05:31.151
470186,40º Mutirão da Prefeitura destaca chamamento para vacinação junto com Ministério da Saúde - Leia no Diário de Goiás: Conteúdo de verdade com jornalismo profissional https://t.co/px4cRk5Nac,0,0,0,0,16384,13676,451,,2025-05-29 12:07:28.927,2025-05-29 12:07:28.927
470189,Minas Gerais decreta emergência após caso de gripe aviária em pássaro ornamentalhttps://t.co/HVgb8Yr5Jg,8,0,0,0,610,8850824,165060,,2025-05-29 12:08:35.559,2025-05-29 12:08:35.559
470191,Laudo descarta morte por febre amarela em corpo de macaco encontrado no Parque Cesamar#g1Tocantins #tvanhanguera #saúde #vacinahttps://t.co/WA6cmmxxu8,0,0,0,0,7395,57572,14,,2025-05-29 12:09:33.529,2025-05-29 12:09:33.529
470195,Pouco mais de 16% das crianças e adolescentes cadastrados receberam duas doses da vacina contra a dengue em Uberlândia #g1 #g1triangulohttps://t.co/ygj6Ym2kXi,1,0,0,0,68633,0,0,,2025-05-29 12:10:50.912,2025-05-29 12:10:50.912
470210,"A Fundação Centro de Controle de Oncologia do Estado do Amazonas (FCecon) retomou, nesta sexta-feira (08/10), as atividades do estudo sobre a associação do papilomavírus humano (HPV) com o câncer de cabeça e pescoço no Brasilhttps://t.co/YNhU0zLw89",0,0,0,0,68482,0,0,,2025-05-29 12:14:35.504,2025-05-29 12:14:35.504
470213,Pneumonia silenciosa é marcada por sintomas discretos e tem preocupado médicos; conheça a doençahttps://t.co/lGbO23whuA,0,0,0,0,34498,0,0,,2025-05-29 12:15:25.375,2025-05-29 12:15:25.375
470214,Gripe aviária: Minas tem média de 700 notificações de ocorrências com aves por anoO número foi apresentado em coletiva de imprensa do governo estadual nesta quarta-feira (28) como uma tentativa de tranquilizar a populaçãohttps://t.co/RUtXDPE8l6,1,0,1,1,611,446811,131,,2025-05-29 12:15:40.424,2025-05-29 12:15:40.424
470219,Prefeitura abre as portas para vacinação contra a gripe em Curitibahttps://t.co/CK4jj1zHa5,0,0,0,0,14654,27003,753,,2025-05-29 12:17:42.981,2025-05-29 12:17:42.981
470223,"GRIPE AVIÁRIA | O ministro da Agricultura e Pecuária, Carlos Fávaro, confirma que a China deixará de comprar carne do Brasil por 60 dias.",5,1,1,1,6255,1542009,186,,2025-05-29 12:18:56.650,2025-05-29 12:18:56.65
470225,#JA2 de hoje te atualiza sobre as novas medidas da Prefeitura de Palmas contra o coronavírus e a chegada de mais imunizantes. A gente te esperar na @TvAnhangueraTO a partir das 19h. https://t.co/Kws7VKr28y,2,0,1,1,68642,0,0,,2025-05-29 12:20:36.669,2025-05-29 12:20:36.669
470228,RT @g1tvintegracao: Centro de atendimento à pacientes com a Covid-19 começa a funcionar em Campina Verde https://t.co/SQjhu3AqR9 #G1Triângu…,0,0,1,1,68956,0,0,,2025-05-29 12:21:55.799,2025-05-29 12:21:55.799
470239,"#Boa noite! Hoje atingimos a marca de 200 mil doses aplicadas da vacina contra a covid-19. Amanhã (6) encerramos a vacinação dos idosos, com o início da imunizaçção na população com 60 anos. Confira!https://t.co/dBGxLyarPj",18,3,1,1,69066,0,0,,2025-05-29 12:33:56.202,2025-05-29 12:33:56.202
470453,Confira onde se vacinar contra a Covid-19 em Curitibahttps://t.co/xwqOBQEQ2V,0,0,0,0,20450,0,0,,2025-05-29 15:17:38.252,2025-05-29 15:17:38.252
470456,"BAIXA: Agevisa confirma 17 novos casos de Covid-19 e nenhuma morte, em RO - https://t.co/gL0hyudqJD https://t.co/Al6gat3QoA",0,0,0,0,72905,0,0,,2025-05-29 15:18:43.433,2025-05-29 15:18:43.433
470457,"➡️ Brasil ultrapassa marca de mil mortes por dengue em 2025 #sbtnews Número é liderado pelo estado de São Paulo, que contabiliza 692 dos registroshttps://t.co/srXMjMzvq4",2,0,1,1,5187,589809,165,,2025-05-29 15:19:05.746,2025-05-29 15:19:05.746
470458,@MarcioPecego @evandroratho Ele comprou a vacina no dia q a Anvisa aprovou,3,0,0,0,132319,216,638,Osasco/SP,2025-05-29 15:19:28.151,2025-05-29 15:19:28.151
470460,"Educação é direito, não moeda de troca para agendas sanitárias.A Comissão presidida pela senadora Damares Alves aprovou o fim da exigência do passaporte vacinal contra Covid-19 nas escolas.Uma vitória para o Estado de Direito, para os pais que defendem sua autoridade familiar https://t.co/9i1p5CFibe",168,1,47,47,122749,296365,709,,2025-05-29 15:19:37.348,2025-05-29 15:19:37.348
470462,"Tô com um probleminha de saúde e, após olhar meus exames, a primeira coisa que eu ouvi da médica foi: ""A sua sorte é que você não tomou a ""v4cina"" do Covid..."".Deus ter me formado jornalista não foi à toa. Se não fosse o Espírito Santo direcionando...",2,2,0,0,2138,2341,4379,,2025-05-29 15:19:42.864,2025-05-29 15:19:42.864
470465,ela esqueceu a dose de reforço galera,2,0,0,0,131500,498,325,jurídico estela toledo,2025-05-29 15:19:49.258,2025-05-29 15:19:49.258
470467,"@apropriajulia Mas pode todas UTI de SC sem leitos vagos devido as pessoas não se vacinaram.Você é bandido ao lutar contra vacinas, prefere ver pessoas mortas, internadas",1,0,0,0,2822,1830,3657,"Balneário Camboriú, Brasil",2025-05-29 15:20:02.028,2025-05-29 15:20:02.028
470469,@comentaristadey Eu ja vacinei... agora só falta essas meninas daqui irem la vacinar tb. 💉,1,0,0,0,132320,141,436,,2025-05-29 15:20:14.158,2025-05-29 15:20:14.158
470470,"Dr. Peter McCullough: Numa série de 325 autópsias, descobriram que ""73.9% dos casos ou foi a vacina que causou a morte ou contribuiu significativamente para a morte""Dia após dia, surgem novas provas, mas a nossa comunicação social continua em absoluto silêncio. Porquê?",1,0,0,0,3242,151,277,,2025-05-29 15:20:20.774,2025-05-29 15:20:20.774
470471,Por que será que o CDC não quer revelar os dados dos eventos adversos de vacinas ? @AaronSiriSG entrou com uma ação judicial contra o CDC em nome do @ICANdecide. É o que temos para o momento. Em breve a versão brasileira. Aguardem.,71,2,23,23,15283,34465,1377,Portugal,2025-05-29 15:20:27.619,2025-05-29 15:20:27.619
470473,"@MCR_3D @yesnoni__ @reportersalles A proteína Spike produzida por vacinas COVID-19 é geralmente menor em quantidade e duração do que na infecção natural. Estudos mostram que, em vacinados sem complicações, a proteína é quase indetectável no sangue, enquanto a infecção pode gerar níveis mais altos, especialmente em",12,8,0,0,128140,1938636,2,wherever you are,2025-05-29 15:20:37.240,2025-05-29 15:20:37.24
470475,"@Vetor07911041 @schmittpaula @jantoniocs29 Então o Q.I desses não é alto, já q eles não tem Senso Crítico para analisar as reações adversas das vacinas do COVID e conseguir concluir os efeitos.",2,1,1,1,35,4628,5721,,2025-05-29 15:20:44.278,2025-05-29 15:20:44.278
470479,@lksrdrgs @tocadoogro @1eozinho01 De onde vc tirou que pernilongo defeca após inoculação da saliva? Virou barbeiro foi?,1,0,0,0,132321,13,21,"João Pessoa, Brazil",2025-05-29 15:20:50.363,2025-05-29 15:20:50.363
470483,A gripe mata! https://t.co/9d0hjKgo4F #ODia,1,0,0,0,883,914729,123,,2025-05-29 15:21:04.857,2025-05-29 15:21:04.857
470485,@fernaolmesquita Redução populacional... https://t.co/xd5MwaPxUh,1,0,1,1,1751,1382,1379,,2025-05-29 15:21:07.779,2025-05-29 15:21:07.779
470491,"A edição desta quarta-feira do Jornal O Imparcial destaca: surto de gripe e aumento de internações em São Luís, desconto para servidores do Estado em farmácias, Prefeitura da capital é condenada a reformar prédios, e muito mais. Leia em: https://t.co/b7FqQ74bwO https://t.co/KcibiJ6Kpf",0,0,1,1,77789,35236,60,,2025-05-29 15:21:48.413,2025-05-29 15:21:48.413
470511,"Eu nem sou fã do tenista No Vax Djo Covid, mas as palavras do Mouratoglou são absolutamente desrespeitosas com quem, goste-se ou não, é o maior vencedor da história do Tênis...",3,4,0,0,75998,6755,1753,São Paulo,2025-05-29 15:30:14.489,2025-05-29 15:30:14.489
470512,"superesplendorosa calígine dum silêncio que ensina ocultamente, a qual superilustra no  obscuríssimo o que é supermanifestíssimo, e que no completamente impalpável e invisível  superpreenche com esplendores superbelos as mentes inoculadas. Seja esta a minha oração.(+)",3,1,0,0,131437,806,247,Roma,2025-05-29 15:30:26.514,2025-05-29 15:30:26.514
470514,Antes de 2021 nenhuma criança ou adolescente havia morrido por parada cardíaca. Maldita vacina 😠😠😠😠,2,0,0,0,131518,189,227,,2025-05-29 15:30:46.588,2025-05-29 15:30:46.588
470534,Gripe aviária: Emirados Árabes suspendem compra de frango pela primeira vez; Rússia afrouxa bloqueio.#Gripeaviária #Montenegro #RioGrandedoSul #Frango #TVCultura https://t.co/R0CKeqTNnb,1,0,0,0,4303,885832,233,,2025-05-29 15:36:37.105,2025-05-29 15:36:37.105
470560,"Entenda o que é pneumonia silenciosa, que tem alertado autoridades de saúde#PortalR7 #R7 #JR24H #JornalDaRecord https://t.co/giublTjzvr",2,1,0,0,612,535817,40,,2025-05-29 15:59:41.400,2025-05-29 15:59:41.4
470578,"Em meio a emergência por gripe aviária, fiscais agropecuários do RS reclamam de sobrecarga. 156 vagas para fiscais estão abertas, sem previsão de serem ocupadas, segundo a Afagro.https://t.co/m44PYuAKSJ",2,0,1,1,791,48693,803,,2025-05-29 16:12:24.412,2025-05-29 16:12:24.412
470582,"Pergunta para @SimoneTebetms: Se vacina tinha Prince, alguém cobrava Jackson 5%?",6247,243,326,326,72907,0,0,,2025-05-29 16:13:47.664,2025-05-29 16:13:47.664
470678,ALERTA DE FAKE NEWS!!! Estão espalhando que o governo vai vacinar crianças à força. É mentira — e é perigoso demais deixar isso circular assim.Lula lançou o maior programa de vacinação nas escolas da história. Serão quase 30 milhões de crianças protegidas contra doenças que o…,4145,129,1041,1041,6753,2249345,1630,,2025-05-29 16:24:40.413,2025-05-29 16:24:40.413
470681,"🧡 Vacina é vida. Vacina previne.Leandro Tupinambá celebrou o lançamento do MVPI no território Kiriri, na Bahia.Vacinar é mais do que um ato de saúde — é um compromisso com a história e o futuro.",3,1,0,0,228,1338829,321,"Brasil, Brasília",2025-05-29 16:24:54.480,2025-05-29 16:24:54.48
470683,"@MLucchinni A vacina foi um experimento para testar em humanos, não sei como tiveram coragem de vacinar crianças, colocando seus próprios filhos em risco,a vacina que mal tinha informações sobre o que causaria,quantos adultos, crianças e adolescentes idosos morreram depois de tomá-la",3,0,0,0,131441,2335,2467,Brasil🇧🇷,2025-05-29 16:25:05.527,2025-05-29 16:25:05.527
470687,"🚨 Em pouco tempo estarão colocando ""vacina"" da Covid na BCG. Mas, por enquanto, querem desaparecerem com os idosos mais rapidamente... https://t.co/2fuxXY8y4J",12,0,6,6,81433,399726,15090,,2025-05-29 16:25:22.030,2025-05-29 16:25:22.03
470695,"criança com tuberculose correndo pelo hospital sem máscara, mãe sem máscara, eu tenho q coletar sangue com a criança tossindo em mim 😀",1,1,0,0,132335,231,153,"Curitiba, Brasil",2025-05-29 16:26:14.527,2025-05-29 16:26:14.527
470696,"@TheBigMoronic @GoodNerd23 mas resumindo a biologia:- vacinas contra VIRUS tipo hepatite B, a vacina é uma dose fraca do virus pra q seu corpo crie anticorpos CONTRA o virus - vacinas pra bacterias tipo tuberculose é pra prevenir infecção ou neutralizar- vacina pra fungo NAO EXISTE ainda",78,6,0,0,131567,349,630,,2025-05-29 16:26:23.380,2025-05-29 16:26:23.38
470698,"@joaquimsacouto As vacinas deviam ser todas proibidas!   o Pasteur , o Jenner , o Calmette e o Guerin e o Salk deviam ter morrido logo à nascença !!!",1,1,0,0,131872,521,1084,,2025-05-29 16:26:30.093,2025-05-29 16:26:30.093
470709,"Uma dúvida pra quem é da área da saúde... eu já tive hepatite A, posso tomar a vacina?",8,4,0,0,33032,8875,1866,Belém - Pará / Brasil,2025-05-29 16:27:46.773,2025-05-29 16:27:46.773
470712,O prep protegendo os gays do hiv mas dando gonorreia e hepatites do abecedário todo,1,1,0,0,131444,331,534,,2025-05-29 16:27:57.692,2025-05-29 16:27:57.692
470715,"@nayanezani Eu pessoalmente odeio, especialmente as 3 doses da pentavalente q deixaram meu filho péssimo. Mas eu odiaria mt mais ver ele doente sabendo q eu podia ter prevenido, então o cartão de vacinas ta bonitinho cm tds as doses em dias.",6,1,0,0,95940,2714,4317,"Cuiabá, Brasil",2025-05-29 16:28:09.309,2025-05-29 16:28:09.309
470717,"@hellriq @enf_intensiva Falando o sujeito que não teve paralisia infantil porque os pais o vacinaram, não teve sarampo, caxumba, difteria ( crupe) porque os pais não eram ignorantes e o deixaram viver. Os seus pais n deveriam ter te vacinado, seria um idiota a menos no mundo!",6,0,0,0,6870,2021,2583,"Caputira, Brasil",2025-05-29 16:28:20.937,2025-05-29 16:28:20.937
470734,"@VEJA @EconomicoRadar Mah cê jura? Segundo os bolsonaristas o pária mundial não interessa ninguém, a ""coqueluche"" do mercado é a Argentina. Alguém está mentindo. Vou confirma aqui no Whatsapp....",2,0,0,0,132346,326,1028,Gotham City,2025-05-29 16:30:01.513,2025-05-29 16:30:01.513
470736,@luczvd e o nome dessa porra eh pertussis tb se n me engano,1,1,0,0,131722,287,252,v ♡,2025-05-29 16:30:08.894,2025-05-29 16:30:08.894
470741,"O 🇧🇷 Brasil doou 40 mil doses da vacina HPV e 4 mil doses da DTP (tríplice bacteriana) a El Salvador 🇸🇻, em ação humanitária que não afeta nosso estoque nacional. As vacinas ajudam, respectivamente, na prevenção do câncer de colo de útero e contra difteria, tétano e coqueluche. https://t.co/g21BL7vemn",6,1,1,1,34466,3647,1361,Brasília - DF,2025-05-29 16:30:31.259,2025-05-29 16:30:31.259
470743,"A vacina dt dói p uma porra, ainda bem que é a cada 10 anos 🤣🤣🤣🤣🤣",1,1,0,0,132018,670,425,"Rio de Janeiro, Brasil",2025-05-29 16:30:38.697,2025-05-29 16:30:38.697
470745,a gente indo atualizar as vacinas pro internato a dois pitacos de fazer cena exigindo uma dtpa que n querem dar https://t.co/QuMXPqixlw,1,0,0,0,131531,757,1360,rj → slz,2025-05-29 16:30:47.480,2025-05-29 16:30:47.48
470749,"@LeoKasura Se não acreditam,  então me expliquem porque o governo quer mudar a vacina da Polio em gotas para injetável.... 🤬",8,0,0,0,131450,9,31,,2025-05-29 16:31:06.831,2025-05-29 16:31:06.831
470751,@mepivacaina @siteptbr tempo bom qnd as taxas de roubo morte latrocínio suicídio depressão asfixia borderline tdah bipolaridade tétano poliomelite chicungunya dengue zika covid monkeypox gripe ansiedade pancreatite hepatite cárie acidentes de trânsito eram todas zeradas🤧,1,1,0,0,131350,129,532,🌎,2025-05-29 16:31:16.425,2025-05-29 16:31:16.425
470755,"@rubel RUBEEEEEEL!!!!!!!😭😭😭😭😭SOLTAAAAA POR FAVOOOR😭😭😭😭😭 tenho depressão, ansiedade, pânico, pressão alta, pressão baixa, dengue, zika, chicungunha, peste negra, poliomielite, paralisia infantil, osteoporose, gripe suína, febre amarela, meningite, gonorreia, herpes, faringite,",20,0,1,1,131453,112,163,"Rio de Janeiro, Brasil",2025-05-29 16:31:44.452,2025-05-29 16:31:44.452
470759,caraaaca perdi 3kg nunca foi musculação sempre foi rotavírus😩🙏,1,0,0,0,131352,258,437,,2025-05-29 16:31:59.257,2025-05-29 16:31:59.257
470762,@abeldasorte @Jb951998 @pegoncalves Acho engraçado que tem boa chance de que um cara desse só não morreu de sarampo na infância por causa da tríplice viral e fica aí falando bosta,2,0,0,0,131454,48,878,,2025-05-29 16:32:27.524,2025-05-29 16:32:27.524
470766,"@apropriajulia Meu marido tem alergia a vacinas , principalmente as que utilizam ovos de galinha no processo de produção de gripe, a de febre amarela, e a tríplice viral (sarampo, caxumba e rubéola) são exemplos de vacinas que podem conter traços de proteína de ovo e ainda tem alergia a carne.",3,1,0,0,2171,31001,3267,"Rio de Janeiro, Brasil",2025-05-29 16:34:42.390,2025-05-29 16:34:42.39
470767,"@NewsLiberdade São retardados?caxumba, rubéola, hepatite, hib, poliomielite, varicela, rotavírus.Vcs são contra essas vacinas da época da minha tataravó? isso é coisa de gente burr/atapada, bando de porcos acéfalos. Deveriam ser presos os pais q deixam seu filho pegar polio,e ficar paralítico.",102,3,5,5,124243,56,173,,2025-05-29 16:34:57.594,2025-05-29 16:34:57.594
470770,@filipebarrost @FelipePedri @BolsonaroSP @pfigueiredo08 @CoryMillsFL Qual a diferença disso para quem cria um bebê reborn?,8,0,0,0,97579,224,410,,2025-05-29 16:35:50.148,2025-05-29 16:35:50.148
470773,"Graças a Deus o inferno da herpes zóster tá curando, criando casquinha 🙏 esse inferno desse vírus é reativado por conta da catapora que eu tive na infância, estorou no corpo todo, mas na maior parte nas costas, dor dos infernos https://t.co/iNutw2omeY",1,1,0,0,131461,1176,715,RJ 🇧🇷,2025-05-29 16:36:07.244,2025-05-29 16:36:07.244
470774,@juliaattene Paciente 18 anos fazendo a primeira DTPa/ Meningo c da vida... O pessoal brinca muito com a vida dos filhos.,2,0,0,0,131555,4111,761,"Cabo Frio, Brasil",2025-05-29 16:36:14.718,2025-05-29 16:36:14.718
470775,"@Dani7712707635 @GayerGus meningite é uma inflamação rara de membranas que envolvem o cérebro, mas que se propaga por gotículas respiratórias no ar, como tosse e espirro.E encefalite uma inflamação do cérebro que se propaga por picadas ou ferroadas de animais! Por isso está foragido: mentiroso contumaz",4,0,0,0,116510,1904,2500,,2025-05-29 16:36:56.362,2025-05-29 16:36:56.362
470776,"Absurdo! Só na Republica Democrática do Brasil ainda há a imposição dessa vacina. Já vivemos no passado surtos perigosos de meningite, sarampo, poliomielite etc e nem por isso a população foi ameaçada desse jeito para se vacinar.A pergunta de milhões: POR QUE?",1,0,1,1,1935,3439,3214,,2025-05-29 16:37:07.753,2025-05-29 16:37:07.753
470777,"@haxilov BCG, Hepatite B, Penta (DTP+Hib+Hepatite B), VIP, Meningocócica C, Pneumocócica 10-valente, Rotavírus, Febre Amarela, Tríplice Viral (SRC) e VOP (Vacina Oral Poliomielite). São essas.   As vacinas são testadas e melhoradas sempre, a única contradicacao é a de alergia a ovos já",13,1,0,0,73877,62829,558,"Vila Velha, Brasil",2025-05-29 16:37:16.076,2025-05-29 16:37:16.076
470780,"@BrunnoMeloCBN Pois é, eu e minha esposa tomamos a vacina contra gripe no final de abril. Pagamos pelo convênio da OAB a quadrivalente.Estamos desde o dia 5 de maio com uma gripe que insiste em não sarar.Muito estranho isso…",1,1,0,0,28686,625,2050,Brasil,2025-05-29 16:39:37.154,2025-05-29 16:39:37.154
470782,"@kleriene18 Raramente me dizem “ok” depois de eu informar que não quero ter filhos. 99% das vezes vem: “mas pq não quer?”, seguido de “vai que muda de ideia, né”. Tive câncer de colo de útero, então quem sabe disso geralmente pergunta: “mas se tu quisesse, poderia ter?” UM PORRE.",2,0,0,0,105902,171,326,Brasil,2025-05-29 16:40:19.539,2025-05-29 16:40:19.539
470787,em pleno 2025 e a pessoa ta com corona virus vsf vamos querer nos atualizar né meu querido,1,1,1,1,132356,365,259,"Rio de Janeiro, Brasil",2025-05-29 16:42:20.907,2025-05-29 16:42:20.907
470789,"VACINA 100% BRASILEIRA CONTRA A COVID-19 | A @ufmg anunciou que a SpiN-TEC, primeiro imunizante contra o novo coronavírus com tecnologia e insumos totalmente nacionais, avança para a fase 3 dos testes clínicos – a última antes de ser enviada para aprovação pela Anvisa. https://t.co/CfV5lvLaI2",525,37,216,216,3153,344229,320,Brasília - DF,2025-05-29 16:42:36.521,2025-05-29 16:42:36.521
470790,"@Pisciana8652011 @CatarinaLucindo @flaviocostaf Foi no governo dele que 700 mil pessoas morreram de corona porque ele se negou a comprar a vacina, boicotou o distanciamento social e as máscaras e mandou o povo tomar cloroquina.  E depois tentaram lucrar 1 dólar por cada dose de vacina. Canalha tem que apodrecer na cadeia",1,1,0,0,8131,655,733,"Nordrhein-Westfalen, Deutschla",2025-05-29 16:42:49.863,2025-05-29 16:42:49.863
470797,"@queloucuragente @reporterenato Não,  gripe é causada por vírus influenza, covid é vírus sars-cov, a diferença é básica  em tudo inclusive no tratamento.  Estude.",0,1,0,0,1030,204,363,,2025-05-29 16:47:13.013,2025-05-29 16:47:13.013
470799,@grok @reportersalles @grok existem estudos que indicam que o contato com o coronavírus SARS-CoV-2 pode aumentar o risco de problemas cardíacos?,2,1,0,0,131359,12,9,Futuro,2025-05-29 16:48:04.181,2025-05-29 16:48:04.181
470804,"Meu deus o hospital tá hiper mega organizado chocada, já fiz até teste de influenzaa cara",2,0,0,0,132057,88,160,"São Caetano do Sul, Brasil",2025-05-29 16:50:31.781,2025-05-29 16:50:31.781
470805,"@NaniChemello Depois da vacina,estou na segunda...fiz uso indicado pela pneumo de antibiótico.",1,1,0,0,35924,70,376,", Brasil",2025-05-29 16:50:49.391,2025-05-29 16:50:49.391
470810,era esse povo antivax anos antes do covidela tava contrariada q precisava tomar a vacina da febre amarela pra ir viajar pra uma área endêmica e me contou no maior sigilo q era pq vacina causava autismoisso em 2016 tá kkkkk,1,0,0,0,131477,694,695,,2025-05-29 16:52:55.995,2025-05-29 16:52:55.995
470813,@inoxnext feliz aniversário inoooooooox! tmj demais  pcr slk💥🤙🏽,1,0,0,0,131281,152,138,purplewrld,2025-05-29 16:55:58.286,2025-05-29 16:55:58.286
470816,"@majorgabdf @JornalOGlobo Tem sim, já vi uma vez no Instagram, mas acho que a pessoa apagou com medo da Gestapo",1,0,0,0,35958,71,396,,2025-05-29 16:57:27.877,2025-05-29 16:57:27.877
470818,@winnybli RECEBA O VIRUS CHINÊS,1,1,0,0,132358,20,297,,2025-05-29 16:58:27.560,2025-05-29 16:58:27.56
470826,"🇧🇷🤝🇨🇳 *Fortalecendo o SUS e a indústria brasileira da saúde!* Em visita à China, o ministro da Saúde, Alexandre Padilha, anunciou a assinatura de três grandes acordos que vão ampliar a produção nacional de equipamentos, vacinas e insumos estratégicos.✅ Equipamentos como https://t.co/VrGSKYtx9G",170,5,76,76,75030,31694,13757,Porto Alegre,2025-05-29 17:01:29.609,2025-05-29 17:01:29.609
470905,"@chefdangalhardo ""A ANVISA (Agência Nacional de Vigilância Sanitária) recomenda que o cozimento do frango alcance uma temperatura interna mínima de 70°C para garantir a eliminação de bactérias e garantir a segurança alimentar.""não tem dessa de ou ta cru ou ta cozido.",1617,10,7,7,132365,37,693,,2025-05-29 17:43:53.586,2025-05-29 17:43:53.586
470922,"@rennatodutra Quem reg. os planos de saúde e faz com que sejam obrigados a oferecer muitos tratamentos é o SUS, comece a se informar mais e estudar mais, aliás um simples remédio que hoje tem genérico é devido ao SUS! Uma ambulância é sus... Muitas outras coisas. Lei 8080/90 é um bom começo!",2,0,0,0,132367,170,390,Brasil,2025-05-29 17:49:47.215,2025-05-29 17:49:47.215
