ID,Título,Sub Título,Texto,Autor,Data Criação,URL
1,Médico de autópsia diz que Juliana Marins morreu 20 minutos após queda,"Brasileira sofreu impacto ao cair no Monte Rinjani, na Indonésia","A alpinista brasileira Juliana Marins morreu cerca de 20 minutos após cair e sofrer ferimentos graves enquanto escalava o Monte Rinjani, localizado na ilha de Lombok, na Indonésia. A estimativa foi divulgada com base na autópsia realizada no Hospital Bali Mandara, em Denpasar.

Segundo o médico legista Dr. Ida Bagus Putu Alit, responsável pela análise, a causa da morte foi uma lesão provocada por forte impacto nas costas, que causou intenso sangramento na cavidade torácica. “O impacto foi forte e ocorreu nas costas da vítima. Estimamos que a morte tenha ocorrido em cerca de 20 minutos após o ferimento”, afirmou o médico em coletiva de imprensa nesta sexta-feira (27).

Questionado sobre relatos de que Juliana ainda teria apresentado sinais de movimento após a queda, o perito preferiu não comentar. “Estamos apenas analisando os fatos com base nos achados da autópsia. Não há evidências de que a vítima tenha sobrevivido por um longo período após o acidente”, declarou.

O caso ganhou repercussão nas redes sociais, após o processo de evacuação da vítima se estender por horas, mesmo com os ferimentos sendo graves. Internautas levantaram dúvidas sobre a agilidade e os procedimentos adotados pelas equipes locais de resgate.

As circunstâncias exatas da queda ainda são apuradas pelas autoridades locais.

O corpo da brasileira foi submetido à autópsia em Bali, onde também ocorrem os trâmites para repatriação. O Itamaraty acompanha o caso por meio da embaixada brasileira no país.
Relembre caso

Juliana, natural de Niterói (RJ) e dançarina profissional de pole dance, fazia uma viagem pela Ásia desde fevereiro e visitou países como Filipinas, Tailândia e Vietnã antes de chegar à Indonésia. Uma amiga descreveu que ela estava ""vivendo um sonho de viajar pela Ásia"".

O acidente ocorreu na última sexta-feira (20), quando Juliana tropeçou, escorregou e caiu a cerca de 300 metros da trilha. Turistas avistaram a situação cerca de três horas depois e alertaram a família pelas redes sociais, enviando localização exata, fotos e vídeos, incluindo imagens de drone.

Desde então, uma campanha pelas redes sociais mobilizou socorristas e governos para resgatar a jovem. Porém, após quatro dias de buscas, a jovem foi encontrada morta.

",CNN,27/06/2025  07h44,https://www.cnnbrasil.com.br/nacional/brasil/medico-de-autopsia-diz-que-juliana-marins-morreu-20-minutos-apos-queda/
2,A revolta de indonésios com críticas ao resgate de Juliana Marins,Jovem morreu durante trilha em vulcão na Indonésia,"Após as críticas que o governo da Indonésia recebeu de brasileiros pela atuação no resgate de Juliana Marins, os indonésios resolveram revidar e lotaram de mensagens o perfil do presidente Luiz Inácio Lula da Silva nas redes sociais. A jovem foi encontrada sem vida quatro dias depois de ter caído durante uma trilha no vulcão Rinjani, na ilha de Lombok. Muitos brasileiros apontam a demora como negligência do governo do país. Em um comentário, um usuário da Indonésia rebate a acusação de que o resgate foi lento. “Mesmo no Monte Everest, onde os melhores alpinistas do mundo usam o equipamento mais avançado, as pessoas ainda morrem à espera de ajuda. Então, por que acha que o Monte Rinjani, com seus penhascos íngremes, nevoeiro espesso e sem acesso aéreo, garante um resgate perfeito? Antes de criticar do seu apartamento no Rio, tente escalar o Rinjani primeiro. Isto não é Copacabana”, disparou o internauta. Teve gente que fez questão de lembrar do 7 a 1 contra a Alemanha na Copa do Mundo e outro que debochou do incêndio e queda de um balão que matou oito pessoas em Santa Catarina: “Sou de Sumatara andando de balão felizmente não queimado”.

",Nara Boechat,27/06/2025 20h13,https://veja.abril.com.br/coluna/veja-gente/a-revolta-de-indonesios-com-criticas-ao-resgate-de-juliana-marins/
3,"Juliana Marins morreu 20 minutos após sofrer trauma contundente e não teve hipotermia, diz legista","Autópsia foi realizada em Bali e o resultado, divulgado nesta sexta-feira (27). O exame, contudo, não pôde apontar o horário exato da morte da brasileira.","A autópsia no corpo de Juliana Marins indica que a brasileira morreu de “fraturas múltiplas e lesões internas”, não teve hipotermia e sobreviveu por 20 minutos após o trauma. O laudo da perícia foi divulgado nesta sexta-feira (27) por autoridades da Indonésia, segundo informou a BBC. O exame, contudo, não pôde apontar o horário exato da morte de Juliana.

Em uma coletiva de imprensa no saguão do Hospital Bali Mandara, em Denpasar, na Ilha de Bali, o médico-legista Ida Bagus Putu Alit deu detalhes do exame.

“Os indícios mostram que a morte foi quase imediata. Por quê? Devido à extensão dos ferimentos, fraturas múltiplas, lesões internas — praticamente em todo o corpo, incluindo órgãos internos do tórax. [Ela sobreviveu por] menos de 20 minutos.”

O legista não soube precisar se esses 20 minutos ocorreram logo após a primeira queda.

Alit acrescentou que não havia sinais de hipotermia, pois não havia ferimentos tipicamente associados à condição, como lesões nas pontas dos dedos.

O corpo da jovem chegou ao Hospital Bali Mandara, em Bali, por volta das 11h35 (horário de Brasília) da quinta-feira (26) para autópsia. Foi levado do Hospital Bhayangkara, na província onde o Monte Rinjani está localizado, de ambulância, já que não havia peritos na província.

Juliana Marins caiu no sábado (21), e seu corpo foi recuperado na quarta-feira (25), após os esforços de busca e resgate terem sido prejudicados pelo mau tempo e pelo terreno acidentado.
A queda
Juliana caiu em um barranco com centenas de metros de profundidade, em direção ao lago Segara Anak, na região do monte Rinjani, por volta das 6h30 do sábado (21).

O local exato é no ponto Cemara Nunggal, uma trilha cercada por desfiladeiros que leva ao cume do Rinjani.

Apesar da queda, as autoridades competentes disseram que Juliana ainda estava viva no sábado. Isso está de acordo com imagens de drones e outros vídeos gravados por vários escaladores — que circularam online e foram transmitidos pela mídia brasileira.

Três dias depois, na terça-feira (24), a equipe de resgate conseguiu se aproximar de Juliana e declarou a vítima morta. Seu corpo foi resgatado no dia seguinte.",g1 Rio,27/06/2025 07h39,https://g1.globo.com/rj/rio-de-janeiro/noticia/2025/06/27/juliana-marins-legista.ghtml
4,O que autópsia revela sobre morte de Juliana Marins em vulcão na Indonésia,,"Um trauma contundente, resultando em danos a órgãos internos e hemorragia, foi a causa da morte de Juliana Marins, a alpinista brasileira que escorregou e caiu enquanto escalava o Monte Rinjani, o segundo vulcão mais alto da Indonésia, segundo autópsia divulgada nesta sexta-feira (27/06) por autoridades locais.

""Encontramos arranhões e escoriações, bem como fraturas no tórax, ombro, coluna e coxa. Essas fraturas ósseas causaram danos a órgãos internos e sangramento"", disse o médico forense Ida Bagus Alit à imprensa na sexta-feira.

""A vítima sofreu ferimentos devido à violência e fraturas em diversas partes do corpo. A principal causa de morte foram ferimentos na caixa torácica e nas costas"", disse o especialista.

O corpo da jovem chegou ao Hospital Bali Mandara, em Bali, por volta das 11h35 (horário de Brasília) da quinta-feira (26/06) para autópsia.

Foi levado do Hospital Bhayangkara, na província onde o vulcão está localizado, de ambulância, já que não há peritos na província.

A autópsia foi realizada na noite de quinta-feira. Alit também afirmou que não havia evidências que sugerissem que a morte tivesse ocorrido muito tempo após os ferimentos.

""Por exemplo, havia um ferimento na cabeça, mas nenhum sinal de hérnia cerebral. A hérnia cerebral geralmente ocorre de várias horas a vários dias após o trauma. Da mesma forma, no tórax e no abdômen, houve sangramento significativo, mas nenhum órgão apresentou sinais de retração que indicassem sangramento lento. Isso sugere que a morte ocorreu logo após os ferimentos"", explicou.

A partir dos resultados da autópsia, ele estima que a morte de Juliana ocorreu em torno de 20 minutos após ela sofrer os ferimentos.

Questionado, no entanto, sobre a estimativa da hora da morte de Juliana, o médico forense Alit respondeu: ""De acordo com meus cálculos, a vítima morreu na quarta-feira, 25 de junho, entre 1h e 13h (horário local).""

Essa estimativa é diferente da declaração da Basarnas (a agência de buscas e resgates da Indonésia) de que Juliana foi encontrada na noite de terça-feira (24/06), ""confirmada morta.""
""De fato, é diferente da declaração da Basarnas. Há uma diferença de cerca de seis horas em relação ao horário declarado pela Basarnas. Isso se baseia nos dados de cálculo do médic"", disse Alit à BBC News Indonésia.

Ele acrescentou: ""É importante lembrar que fatores ambientais, como temperatura e umidade, afetam as alterações post-mortem. Pode haver diferenças.""

Mas observou que é difícil determinar a hora exata da morte devido a vários fatores, incluindo a transferência do corpo da Ilha de Lombok, onde se localiza o Monte Rinjani, para Bali dentro de um freezer — uma viagem que levou várias horas.

""No entanto, com base em sinais observáveis, estima-se que a morte tenha ocorrido logo após os ferimentos"", disse o médico.

Ele acrescentou que não havia sinais de hipotermia, pois não havia ferimentos tipicamente associados à condição, como lesões nas pontas dos dedos.

Juliana caiu por volta das 6h (horário local) do sábado (21/6), ou 19h de sexta-feira (20/6), pelo horário de Brasília.

Horas depois da queda, ela foi vista sentada na encosta ainda com movimentos, em imagens captadas por drone de turistas.

Segundo o chefe do Parque Nacional do Monte Rinjani (TNGR), Yarman Wasur, a informação inicial era de que Juliana teria caído inicialmente em um barranco a cerca de 200 metros de profundidade. No entanto, quando a equipe foi até o local e pilotou o drone, a vítima não estava mais visível no ponto estimado inicialmente.

Na segunda-feira, o perfil oficial do Parque Nacional do monte Rinjani no Instagram informou que Juliana havia sido localizada por socorristas por meio de um drone, presa em uma encosta rochosa a uma profundidade estimada de 500 metros. Na observação visual, ela permanecia imóvel, segundo as autoridades locais.

Assim, a brasileira pode ter sofrido mais de uma queda e não está claro após qual delas ela teria sofrido o trauma contundente que teria levado a sua morte, segundo a autópsia.

Na terça-feira (24/6), a equipe de resgate conseguiu se aproximar de Juliana e declarou a vítima morta. Seu corpo foi resgatado no dia seguinte, após os esforços de busca e resgate terem sido prejudicados pelo mau tempo e terreno acidentado.

Embora vários excursionistas tenham morrido no Monte Rinjani nos últimos anos, a morte de Juliana recebeu a maior atenção, tanto no Brasil quanto na Indonésia.

Usuários de redes sociais brasileiros criticaram a operação de busca e resgate por serem muito lentas, enquanto a família de Juliana declarou nas redes que sua morte teria sido resultado de negligência e que planejam entrar com uma ação judicial.

Autoridades no Brasil se comprometeram a arcar com os custos do traslado do corpo de Juliana. ""Hoje mais cedo conversei com Mariana, irmã de Juliana Marins, e assumimos o compromisso da Prefeitura com o traslado de Juliana da Indonésia para a nossa cidade, onde será velada e sepultada"", escreveu o prefeito de Niterói, Rodrigo Neves (PDT), em suas redes sociais, na noite de quarta-feira.

Já o presidente Lula publicou na quinta-feira que determinou ao Ministério das Relações Exteriores ""que preste todo o apoio à família, o que inclui o translado do corpo até o Brasil.""

Após o corpo de Juliana ser encontrado e evacuado, a família da brasileira disse que deve ir à Justiça.

""Juliana sofreu negligência grave por parte da equipe de resgate. Se a equipe de resgate tivesse conseguido salvá-la dentro das sete horas estimadas, Juliana ainda estaria viva"", escreveu a conta do Instagram @resgatejulianamarins, que afirma representar a família.

""Juliana merecia mais! Agora buscaremos justiça para ela, porque é isso que ela merece!"", acrescentou o relato.

Autoridades locais negam negligência

O chefe do Parque Nacional do Monte Rinjani (TNGR), Yarman Wasur, afirmou que o processo de evacuação foi realizado de acordo com os procedimentos padrões ​​e negou as críticas de que o processo tenha sido lento.

""Formamos uma equipe imediatamente. O processo de formar uma equipe, preparar equipamentos e outros itens leva tempo. Esta equipe precisa ser profissional, pois envolve a segurança também da equipe de evacuação.""

Yarman afirmou que dezenas de socorristas foram mobilizados para a evacuação. O número chegou a cerca de 50 pessoas na terça-feira (25/6).

Ele explicou que o clima extremo e a topografia do local foram os maiores obstáculos para a evacuação.

""Rinjani é um local extremo, com topografia extrema, e o clima aqui muda muito o tempo todo. Isso é o que impede que a equipe de evacuação seja otimizada"", disse Yarman.

Da mesma forma, a Basarnas também afirmou em diversas ocasiões que o processo de evacuação foi dificultado por fatores climáticos, de temperatura e de localização extremos.

Yarman explicou que, pelas informações iniciais obtidas, a vítima caiu em um barranco a cerca de 200 metros de profundidade.

No entanto, quando a equipe foi até o local e pilotou o drone, a vítima não estava mais visível no ponto estimado inicialmente.

""Depois que nossa equipe verificou o terreno, descobriu-se que ela não estava mais lá, havia se movido, caído daquele jeito"", disse ele.

Isso, disse Yarman, fez com que a equipe de resgate perdesse o rastro da vítima. ""Nossa equipe passou a noite procurando. Ela estava perdida lá.""

Além disso, disse ele, as condições climáticas incertas e a topografia extrema fizeram com que o processo de evacuação demorasse dias.

Acidentes repetidos e escalada difícil

Não é a primeira vez que acontece um acidente como o de Juliana. No ano passado, houve pelo menos dois incidentes parecidos. Em um deles, um cidadão da Malásia morreu.

A falta de acesso de segurança para alpinistas em Rinjani se tornou um ponto de destaque para os internautas.

O experiente alpinista Galih Donikara vê a necessidade de melhorar o acesso seguro para escaladores em Rinjani, especialmente em pontos vulneráveis.

""Se, por exemplo, for um barranco perigoso, deve haver uma cerca, corda ou outra barreira entre os barrancos que seja resistente para os escaladores"", disse Galih.

Além disso, disse Galih, é necessário que os policiais em serviço alertem sobre rotas perigosas. Para isso é preciso que os policiais estejam não apenas no ponto de registro, mas também em cada posto de parada.

""E é preciso elaborar um guia conjunto sobre os procedimentos operacionais padrão (POP) para resgate de emergência, de acordo com o potencial de acidentes em cada local. Todos nós nos reunimos, fazemos simulações conjuntas, treinamos guias e socorristas locais para que esses problemas sejam minimizados"", disse ele.

Da mesma forma, o alpinista sênior Ang Asep Sherpa considera a segurança e a orientação importantes, pois frequentemente os alpinistas, especialmente os iniciantes, ignoram a segurança e a necessidade de preparação física e de equipamento.

""Porque o que eles veem nas redes sociais é apenas a beleza, sem descobrir a preparação. E, agora, os alpinistas, desde que tenham dinheiro, só trazem água potável e sentem que podem escalar. É isso que causa muitos acidentes"", disse ele.

O chefe do parque nacional do monte Rinjani, Yarman Wasur, afirmou que implementou uma série de medidas de segurança, como a instalação de cordas e escadas de segurança em diversos locais vulneráveis.

Além disso, sua equipe também instalou cerca de oito câmeras de vigilância e elaborou procedimentos operacionais padrão.

Os regulamentos mais recentes do parque foram revisados em 24 de março de 2025. As regras tratam de escaladores, organizadores de trilhas, guias, carregadores e reservas de ingressos.

""Um dos procedimentos padrões no monte Rinjani é que seis escaladores externos usem um guia e dois carregadores. E isso foi feito"", disse ele.

Yarman também afirmou que seu grupo providenciou dois postos de emergência no Posto Plawangan 1 e próximo ao lago.

No entanto, afirmou que seu grupo realizará uma avaliação completa após o incidente, desde a instalação de infraestrutura de segurança até o aumento do efetivo em pontos vulneráveis.

O organizador de escaladas no Rinjani, Mustaal, afirmou que o monte tem um nível de escalada difícil, especialmente a trilha até o pico conhecido como Letra E.

Essa trilha tem alguns metros de largura, com um contorno arenoso e rochoso em subida, frequentemente acompanhado de fortes rajadas de vento e tempestades.

""Esta trilha exige alta concentração dos escaladores"", disse Mustaal, que gerencia o serviço de escalada.

Mustaal descreveu o local onde Juliana caiu como um terreno muito difícil. ""À esquerda, a inclinação é de 45 graus e o barranco desce em linha reta, especialmente à tarde, quando a neblina fica muito escura.""

Além das influências naturais difíceis, ele disse que os acidentes nessa rota geralmente ocorrem porque os alpinistas estão cansados ​​ou tiram fotos que os fazem perder o foco.

Mustaal, que escala o Rinjani desde 2000, disse que a próxima rota é do pico do Rinjani até o lago Segara Anak, que é uma descida.

""Certa vez, trouxe um hóspede da Austrália. Quando ele desceu para o lago, não estava concentrado. Então, ele tropeçou nos próprios pés e caiu. Mas ele sobreviveu porque a queda não foi tão profunda. Esse é um pequeno exemplo"", disse ele.

Apesar de ter uma rota extrema, Mustaal afirmou que não há proibição para escaladores iniciantes chegarem ao pico do Rinjani.

Ele disse que todos podem escalar o monte Rinjani, mas devem seguir as regras estabelecidas, como estar acompanhados por um guia e carregador local, e ser monitorados para garantir uma boa condição física.

O escalador sênior Ang Asep Sherpa também considerou o monte Rinjani como uma rota de escalada bastante difícil, especialmente em direção ao pico.

""Aproximar-se do pico é um terreno arenoso. Subimos dois degraus e descemos um, então exige muita força física e resistência. Além disso, há ventos fortes e penhascos à esquerda e à direita. Um pequeno erro certamente será um problema"", disse ele.

No entanto, segundo ele, se o alpinista tiver muita resistência física e seguir a rota de escalada, ""ela será realmente segura"".

""Para alpinistas iniciantes, acho que eles precisam se preparar bem. Eles precisam ter boas habilidades físicas e equipamento adequado.""
",BBC News Indonesia,27 junho 2025,https://www.bbc.com/portuguese/articles/cdx5ggydy2yo
5,Juliana Marins: Família se queixa de saber de autópsia pela imprensa: ‘Ninguém falou’,"Em entrevista ao GLOBO, pai e irmã da brasileira morta na Indonésia dizem que não foram informados oficialmente sobre laudo da autópsia, divulgado à imprensa antes do contato com parentes","A família de Juliana Marins, brasileira de 26 anos que morreu após queda no Monte Rinjani, na Indonésia, só soube dos detalhes da autópsia, depois que as informações já haviam sido divulgadas à imprensa, nesta sexta-feira (27).

No Hospital Bali Mandara, em Denpasar, o médico legista Ida Bagus Alit, responsável pelo procedimento, afirmou que não há evidência de que Juliana tenha agonizado por mais de 20 minutos após o trauma que causou sua morte. No entanto, ele não aponta o horário exato em que isso teria ocorrido, e o relato entra em conflito com registros feitos por turistas e com a própria cronologia do resgate.

‘Estou triste, segurei seu corpo a noite inteira’, lamenta voluntário
Quem é o herói anônimo que liderou o grupo que arriscou a vida para salvar Juliana
Família de Juliana Marins acusa resgate de negligência e promete “lutar por justiça”
Lula anuncia novo decreto para custear traslado de Juliana Marins

A família, que está dividida entre o Brasil e a Indonésia, critica a falta de comunicação das autoridades locais. Segundo os parentes, nenhuma informação oficial foi repassada antes da coletiva de imprensa do legista. Mariana Marins, irmã de Juliana, criticou a forma como as informações sobre a autópsia foram divulgadas à imprensa antes mesmo da família ser oficialmente comunicada. Em entrevista a O GLOBO, ela desabafou:

“Tudo o que eu sei, vi pela mídia. Em nenhum momento houve compaixão ou respeito suficiente para nos reunir e informar primeiro. Ficamos sabendo depois porque o legista quis seus 15 minutos de fama, mais um absurdo no meio de toda essa história”, disse Mariana Marins.

Segundo ela, o pai de Juliana, Manoel Marins, está em Bali e só será informado sobre a autopsia da filha à noite (no horário local).

“Eu estou no Brasil, mas meu pai está em Bali. Ele me contou que agora, depois de todo mundo já ter tomado conhecimento da autópsia pela imprensa, talvez façam uma reunião com a família.”

Em entrevista a O GLOBO, Manoel Marins, pai de Juliana, contou que está em Bali aguardando novas informações, mas não foi acionado pelas autoridades para receber detalhes sobre a autópsia feita no corpo da filha. Segundo ele, soube dos resultados apenas por meio de portais de notícia.

Além da forma como a informação foi divulgada, a família também coleciona dúvidas sobre quando Juliana teria morrido. Sua irmã, Mariana, questiona a própria cronologia apresentada pelo legista. Segundo ele, a morte teria ocorrido entre 12 e 24 horas antes das 22h05 — mas não deixa claro a que dia se refere. Juliana caiu no sábado, dia 21, pela manhã, e o corpo foi resgatado apenas na quarta-feira seguinte. A estimativa de morte nesse intervalo abre margem para interpretações contraditórias.

“Se o legista disser que a morte foi 12 horas após a primeira queda, isso é mentira. Temos relatos de turistas, registros, vídeos… muita coisa que comprova que a Juliana ficou viva por muito mais tempo. O ferimento fatal pode ter acontecido na última queda, já perto do resgate. Agora, se ele confirmar que foi entre 12 e 24 horas antes do resgate, isso muda tudo”, diz muita coisa, completou Mariana.

Imagens feitas por turistas mostram Juliana com vida pelo menos três horas após a queda inicial. Ela teria pedido ajuda, e o grupo utilizou um drone para localizá-la. As gravações foram entregues à família e aos voluntários envolvidos nas buscas.",Agência O Globo,27/06/2025 14h17,https://www.infomoney.com.br/mundo/juliana-marins-familia-se-queixa-de-saber-de-autopsia-pela-imprensa-ninguem-falou/
6,Autópsia indonésia conclui que Juliana Marins morreu de hemorragia,Equipe descartou morte por hipotermia,"A autópsia realizada por legistas na Indonésia concluiu que a turista brasileira Juliana Marins morreu em decorrência de hemorragia, provocada por danos a órgãos internos e fraturas ósseas. Segundo os legistas, os ferimentos foram provocados por traumas por contusão, ocorridos algumas horas antes do resgate do corpo.

Eles explicaram que depois do início da hemorragia, a morte levou menos de 20 minutos para ocorrer. A equipe também descartou morte por hipotermia, porque não há sinais de lesões teciduais nos dedos. O resultado final da autópsia, que ainda incluirá exames toxicológicos, deverá sair em duas semanas.

Juliana Marins fazia uma trilha no Monte Rinjani, na ilha de Lombok, na Indonésia, no último sábado (21), quando caiu na cratera do vulcão. A brasileira esperou viva pelo resgate provavelmente por três ou quatro dias, mas quando as equipes de socorro chegaram até ela, constataram que já tinha morrido.

Na noite de quinta-feira (26), no horário do Brasil, o pai de Juliana, Manoel Marins, disse que ainda estava em Lombok, esperando pelo atestado de óbito para trazer o corpo da filha de volta.

Nesta sexta-feira (27), o presidente Luiz Inácio Lula da Silva, publicou, no Diário Oficial da União, decreto que permitirá que o translado de Juliana Marins possa ser pago pelo governo brasileiro. 

“O governo federal prestará todo apoio necessário à família de Juliana Marins, inclusive o translado ao Brasil. Vou editar novo decreto para que o governo brasileiro assuma a responsabilidade de custear as despesas do translado para o Brasil da jovem Juliana para que seus familiares e amigos possam se despedir dela com todo carinho e amor merecidos”, escreveu Lula em seu perfil na rede social Instagram, nessa quinta-feira (26).

",Agência Brasil,27/06/2025 09h02,https://agenciabrasil.ebc.com.br/internacional/noticia/2025-06/autopsia-indonesia-conclui-que-juliana-marins-morreu-de-hemorragia
