ID,Título,Sub Título,Texto,Autor,Data Criação,URL
7,Imagens de drone mostram penhasco onde Juliana Marins caiu. Vídeo,Imagens mostram a altura da queda de Juliana e a operação de resgate que mobilizou 30 socorristas na Indonésia,"Imagens impressionantes feitas com um drone por equipes de resgate na Indonésia mostram, em detalhes, o penhasco do Monte Rinjani, na Indonésia, onde a turista brasileira Juliana Marins, de 26 anos, caiu e morreu.

Juliana caiu por aproximadamente 600 metros em direção ao lago Segara Anak, em uma área íngreme e rochosa da trilha Cemara Nunggal, uma das rotas que levam ao cume do vulcão. O trecho é cercado por desfiladeiros e é exigente mesmo para montanhistas experientes.

O vídeo divulgado pelos socorristas percorre a trilha desde a parte superior, onde a jovem publicitária foi vista pela última vez, até a área onde seu corpo foi encontrado. Nas imagens, é possível ver profissionais espalhados por diferentes pontos do paredão, além de cordas penduradas no penhasco, utilizadas para acessar a área de difícil alcance.

Um dos resgatistas que compartilhou as imagens e aproveitou para fazer um desabao nas redes sociais.

“Ok, talvez este vídeo possa responder e explicar: Não somos heróis e não esperamos ser chamados de heróis. Agimos com base na humanidade para manter o bom nome da Indonésia: 4 socorristas no local da vítima, 3 socorristas de prontidão na beira do penhasco, 23 socorristas apoiando o equipamento do sistema no cume”, escreveu.

Cronologia

Sábado (21/6): Juliana Marins fazia uma trilha no Monte Rinjani e cai cerca de 200m em terreno íngreme do vulcão. Buscas começam, e a turista é filmada por drone sentada na encosta. Nas imagens ela ainda se mexe.
Domingo (22/6): Resgate é suspenso por causa das condições climáticas na região, com muita neblina. Itamaraty informa que estava em contato direto com autoridades locais
Segunda-feira (23/6): Drone operado por resgatistas chega até a jovem. Ela aparece imóvel a 400m do penhasco do vulcão.
Terça-feira (24/6): Equipes de resgate encontram o corpo de Juliana a 600 metros de profundidade.
Quarta-feira (25/6): O corpo da brasileira é retirado do Monte Rinjani, já sem vida. Juliana é içada com uso de cordas. O processo de evacuação por helicóptero não pôde ser realizado devido às condições climáticas.

Autópsia

Um legista que realizou a autópsia em Bali informou que a morte ocorreu em decorrência de um forte impacto com objeto de superfície dura e plana.

A vítima teve ferimentos por todo o corpo, sendo o mais grave nas costas. Segundo ele, a morte foi quase imediata, ocorrendo no máximo até 20 minutos após o impacto. O especialista descartou causas como hipotermia ou inanição.

Juliana estava sozinha no momento do acidente e seguia por uma área considerada perigosa. As autoridades locais chegaram a suspender temporariamente o acesso à trilha para facilitar os trabalhos de resgate, reabrindo o trajeto somente neste sábado (28/6).
",Giovanna Estrela,28/06/2025 16h43,https://www.metropoles.com/mundo/imagens-de-drone-mostram-penhasco-onde-juliana-marins-caiu-video
8,O que dizem especialistas em montanhismo sobre o caso de Juliana Marins?,Jovem de 26 anos ficou quatro dias na encosta de vulcão na Indonésia sem acesso a alimentação e água e foi resgatada sem vida,"A morte da publicitária de 26 anos, Juliana Marins, gerou comoção nacional pela demora do seu resgate e o final trágico. Quando alcançaram a brasileira, que havia despencado ao menos 600 metros na encosta do vulcão Rinjani, em Lombok, na Indonésia, era tarde demais. Sem vida, o corpo foi retirado da encosta cinco dias após a queda. Entre os motivos da revolta da família está a negligência do guia que acompanhava o grupo da turista, do parque e das equipes de resgate no país asiático. Especialistas de montanhismo e de turismo de aventura analisam a tragédia e alertam sobre os riscos que levaram à morte da jovem.

A primeira recomendação dos especialistas é estar acompanhado de um guia. “Ir sem acompanhamento profissional nunca é recomendado, já que podem haver diversos tipos de acidentes: falta de orientação do caminho, uma queda com fratura, uma picada de algum animal peçonhento, perda de equipamento pessoal, falta de comida e tantas outras”, afirma Gabrielle Monteiro, representante da Pisa Trekking, operadora de viagem de aventura e ecoturismo no Brasil.

Monteiro completa que “o ideal numa atividade como essa é ter um guia abrindo a trilha e outro guia fechando a trilha, garantindo que o grupo esteja sempre unido e nunca nenhum turista fique para trás sem supervisão profissional”. No caso de Juliana, que perdeu a vida na encosta do vulcão na Indonésia, relatos dos turistas que estavam com a publicitária e do guia que os acompanhava dão conta que a jovem ficou momentaneamente para trás do grupo pois estava cansada. O guia avançou com o restante, deixando Juliana para trás, segundo relatos.

Saber do repertório dos profissionais e as condições do desafio à frente também são essenciais: “Conhecer o local, quem são os responsáveis, qual seu nível de profissionalização e conhecimento, quais as informações relevantes, minhas condições físicas e que critérios devo adotar para as minhas escolhas, é a combinação necessária para realizar qualquer tipo de atividade de turismo de aventura, de forma segura”, diz Fernanda Dornelles, vice-presidente da ABETA (Associação Brasileira de Empresas de Ecoturismo e Turismo de Aventura).

No Brasil, medidas de segurança regulamentam práticas de turismo de aventura. “Contamos com mais de 40 normas técnicas da ABNT, voltadas exclusivamente para o setor, entre elas a ABNT NBR ISO 21101 – Sistema de Gestão da Segurança, prevista em legislação nacional para o turismo de aventura. Esse arcabouço é fundamental para garantir a qualidade e a segurança das operações”, explica Vinicius Viegas, CEO da Nattrip, agência, operadora e DMC especializada em aventura no país.

O conhecimento do destino, no entanto, tem que se alinhar com a imprevisibilidade da natureza local. Nesse sentido, Dornelles ressalta: “É importante frisar que, ainda que adotem todos os protocolos de segurança, as atividades de aventura, como as mencionadas acima, são suscetíveis às condições da natureza, tal qual as mudanças climáticas e alterações naturais.”

Ricardo Barros, diretor técnico do Clube Niteroiense de Montanhismo (CNM), da cidade natal de Juliana, reafirma o poder da natureza: “Eu gosto de comparar muito a o montanhismo, seja fazendo uma trilha, seja fazendo uma escalada, com surfe. Tem uma onda pequena, uma onda grande, as pessoas que entram no mar e os riscos estão ali expostos. Então a montanha tem mesmo desafios naturais. A natureza não tem isso de não ter segurança. A gente não tem que rebaixar a natureza ao nosso desejo. 

O preparo pessoal também é essencial. Barros ficou surpreso pela aparente falta de recursos de Juliana mostrada nos vídeos gravados por outros turistas e compartilhados. “Falando no âmbito especulativo por não ter todas as informações para comentar, mas me saltou aos olhos que ela não tinha uma mochila, não tinha nada com ela. Não sei se ela não levou, ou deixou cair. Em uma situação como essa, um cobertor de emergência próprio é algo que a gente sempre indica, pois funciona tanto para frio quanto para calor e poderia estar com ela e ter dado uma sobrevida, quem sabe”.

O diretor técnico do CNM destaca, então, a responsabilidade conjunta neste tipo de empreitada: “As pessoas têm que se preparar para ‘fazer’ essa montanha. Ter o calçado adequado, água, comida, um kit de primeiros socorros próprio. Agora a orientação do preparo vai do guia, é parte do profissional orientar as pessoas. É uma necessidade dos próprios guias rever seus conceitos e rever essa questão: ‘Todo mundo pode ir, qualquer pessoa pode ir sem nenhum preparo?’. Infelizmente, a montanha não é democrática. A montanha é para todos, sim, desde que você se prepare para tal.”
",Natalia Tiemi Hanada,26/06/2025 14h57,http://veja.abril.com.br/brasil/o-que-dizem-especialistas-em-montanhismo-sobre-o-caso-de-juliana-marins/
9,"Imagens inéditas revelam primeiras tentativas de resgate de Juliana Marins: 'Ela caiu em um penhasco', diz guia em gravação","Publicitária, de 26 anos, morreu após acidente durante trilha no Monte Rinjani. Família denuncia negligência de guia e autoridades locais.","Imagens inéditas exibidas pelo Fantástico neste domingo (29) mostram as primeiras tentativas de resgate da publicitária Juliana Marins, de 26 anos, que morreu após cair de um penhasco durante uma trilha no Monte Rinjani, na Indonésia. Um registro feito pelo próprio guia mostra a lanterna do capacete de Juliana ainda acesa após a queda. Veja no vídeo acima.

“Ela caiu em um penhasco”, diz o guia na gravação.

O programa também entrevistou com exclusividade os pais de Juliana, que expressaram revolta e indignação com a condução do caso.

“Juliana falou para o guia que estava cansada e o guia falou: ‘senta aqui, fica sentada’. E o guia nos disse que ele se afastou por 5 a 10 minutos para fumar. Para fumar! Quando voltou, não avistou mais Juliana. Isso foi por volta de 4h. Ele só a avistou novamente às 6h08, quando gravou o vídeo e o enviou ao chefe dele”, relata Manoel Marins, pai de Juliana.

O parque acionou uma brigada de primeiros socorros, que iniciou a subida por volta das 8h30. A equipe só chegou ao local do acidente às 14h. Imagens mostram o momento.

“O único equipamento que eles tinham era uma corda. Jogaram a corda na direção da Juliana. Depois, no desespero, o guia amarrou a corda na cintura e tentou descer sem ancoragem”, conta o pai.

A Defesa Civil da Indonésia (Basarnas) só foi acionada mais tarde e, segundo a família, chegou ao local por volta das 19h. Juliana foi encontrada morta dois dias após o acidente. O laudo divulgado na sexta-feira apontou hemorragia interna causada por uma lesão no tórax. A morte teria ocorrido entre 12 e 24 horas antes da remoção do corpo, feita na manhã de quarta-feira.

A família da jovem agora busca justiça.

“É uma indignação muito grande. Esses caras mataram minha filha”, desabafa Estela Marins, mãe de Juliana.

""Os culpados, no meu entendimento, são o guia, que deixou Juliana sozinha para fumar, 40 ou 50 minutos, tirou os olhos dela. A empresa que vende os passeios, porque esses passeios são vendidos em banquinha como sendo trilhas fáceis de fazer. Mas o primeiro culpado, que eu considero o culpado maior, é o coordenador do parque. Ele demorou a acionar a Defesa Civil"", diz o pai.

A prefeitura de Niterói, cidade natal de Juliana, custeou o traslado do corpo e prestou homenagem nomeando um mirante em sua memória. A data do traslado ainda não foi definida.

Tragédia expõe falhas na estrutura do parque

Acidentes no Parque Nacional Monte Rinjani não são raros. A trilha até o topo do vulcão, a 3.700 metros de altitude, pode durar até três dias e tem pouca sinalização e fiscalização.

No dia seguinte à queda de Juliana, um turista da Malásia também caiu e foi resgatado com fratura na bacia. Em outubro de 2024, o brasileiro Bernardo presenciou o resgate do corpo de um turista desaparecido havia nove dias.

“Pagamos mais de mil reais por esse passeio, mas parece que o dinheiro não vai para os guias. É amadorismo total. Muitos sobem de chinelo”, relatou.

A médica Karina Oliani, especialista em resgates em áreas remotas, afirmou que equipamentos adequados poderiam ter feito a diferença.

“Turistas com drones amadores conseguiram visualizar Juliana. Se tivessem um drone profissional, poderiam ter enviado mantimentos e impedido que ela escorregasse mais”, disse.

O Fantástico tentou contato com a polícia, os diretores do parque, com a prefeitura da ilha de Lombok, com o Ministério do Turismo, com o Ministério das Florestas, responsável pelo parque, com o Ministério do Exterior e até com a Presidência da Indonésia, mas ninguém respondeu.",Fantástico,29/06/2025 20h52,https://g1.globo.com/fantastico/noticia/2025/06/29/imagens-ineditas-revelam-primeiras-tentativas-de-resgate-de-juliana-marins-ela-caiu-em-um-penhasco-diz-guia-em-gravacao.ghtml
10,Família de Juliana Marins aciona Justiça por nova autópsia no Brasil,"Com apoio da Prefeitura de Niterói, parentes tentam trazer o corpo da jovem de volta ao país e pedem revisão da causa da morte na Indonésia","A família da publicitária Juliana Marins, que morreu após cair de uma trilha no vulcão Rinjani, na Indonésia, acionou a Defensoria Pública da União no Rio de Janeiro (DPU-RJ) para solicitar judicialmente uma nova autópsia no Brasil.

O pedido foi encaminhado à Justiça Federal com o auxílio do Gabinete de Gestão Integrada Municipal (GGIM), vinculado à Prefeitura de Niterói.

A informação foi divulgada pela irmã da vítima, Mariana Marins, por meio de um perfil criado nas redes sociais para acompanhar o caso. Em contato com a CNN, ela revelou que a família ainda aguarda uma decisão da Justiça nas próximas horas e mantém confiança no Judiciário brasileiro.

""Queremos uma nova autópsia para entender melhor o que aconteceu com Juliana. Infelizmente, convivemos com descaso do início ao fim desde o acidente. Nosso objetivo é apenas entender se tem algo que passou batido ou foi mal interpretado na primeira autópsia"", afirmou Mariana.

Em nota, a Defensoria Pública da União (DPU) confirmou que protocolou petição junto à Justiça Federal solicitando a realização de nova perícia médico-legal no corpo de Juliana Marins. O pedido foi apresentado durante o plantão judicial no domingo (29), mas será analisado pelo juízo natural da causa.

""A instituição segue acompanhando o caso e aguarda a manifestação do Judiciário quanto à petição apresentada"", completa o órgão.

Em uma publicação anterior, ela também destacou a dificuldade enfrentada para confirmar o voo de repatriação do corpo.

“Estamos tentando confirmar o voo que trará Juliana para o Brasil, para o aeroporto do Galeão. Porém, a Emirates de Bali não quer confirmar o voo. É descaso do início ao fim. Precisamos da confirmação do voo da Juliana urgente. Precisamos que a Emirates se mexa e traga Juliana pra casa!”, desabafou.

Juliana Marins, natural de Niterói (RJ), faleceu na sexta-feira (20) após uma queda de cerca de 300 metros durante uma trilha no Monte Rinjani, o segundo vulcão mais alto da Indonésia. Ela estava em uma viagem pela Ásia desde fevereiro e visitava países como Filipinas, Tailândia e Vietnã.

O resgate do corpo levou quase quatro dias devido às condições extremas da região — como neblina densa, pedras escorregadias e terreno íngreme — e foi dificultado pela precariedade das operações locais.

Uma autópsia realizada na Indonésia apontou como causa da morte um traumatismo por força contundente decorrente da queda. O exame ainda aguarda a conclusão dos testes toxicológicos, procedimento que pode levar até duas semanas, embora não haja suspeita de envenenamento ou uso de substâncias.

A Prefeitura de Niterói confirmou que custeou R$ 55 mil para cobrir as despesas de repatriação dos restos mortais e os trâmites funerários no Brasil. O anúncio foi feito na quarta-feira (25) e inclui também o sepultamento da jovem, que será velada em sua cidade natal.

O presidente Luiz Inácio Lula da Silva também determinou que o Ministério das Relações Exteriores prestasse todo o apoio necessário à família. Um decreto publicado no Diário Oficial da União autorizou o custeio do traslado de corpos de brasileiros falecidos no exterior — prática até então vetada pelas normas federais.

Como forma de homenagem, o prefeito de Niterói, Rodrigo Neves (PDT), anunciou que o Mirante e a Praia do Sossego, em Camboinhas, receberão o nome de Juliana Marins. A medida, segundo ele, é uma forma de preservar a memória da publicitária e o carinho que ela tinha pelo local.

O caso de Juliana expôs falhas de segurança nas trilhas do Monte Rinjani, que já registrou oito mortes e cerca de 180 acidentes desde o ano de 2020. Viajantes e especialistas apontam a ausência de sinalização, a lentidão no resgate e a falta de equipamentos como causas recorrentes de tragédias no local.",Camille Couto,30/06/2025 10h41,https://www.cnnbrasil.com.br/nacional/sudeste/rj/familia-de-juliana-marins-aciona-justica-por-nova-autopsia-no-brasil/
11,"Governo brasileiro atende pedido, e corpo de Juliana Marins passará por nova autópsia","Corpo de Juliana deve chegar ao Brasil nesta terça-feira (1º) e, segundo a DPU, o exame necroscópico deve ser realizado em até seis horas após o desembarque, para preservar eventuais evidências sobre as circunstâncias da morte.","A Advocacia-Geral da União (AGU) informou que vai cumprir voluntariamente o pedido de nova autópsia no corpo da brasileira Juliana Marins, que morreu durante uma trilha no vulcão Rinjani, na Indonésia, no último dia 21 de junho. A decisão foi comunicada nesta segunda-feira (30) à 7ª Vara Federal de Niterói, após solicitação feita pela Defensoria Pública da União (DPU).

O corpo de Juliana deve chegar ao Brasil nesta terça-feira (1º) e, segundo a DPU, o exame necroscópico deve ser realizado em até seis horas após o desembarque, para preservar eventuais evidências sobre as circunstâncias da morte.

A decisão de atender com urgência todos os pedidos dos familiares de Juliana partiu de uma determinação do presidente Luiz Inácio Lula da Silva, informou a AGU.

Primeira autópsia

A primeira autópsia foi feita em um hospital na ilha de Bali, no dia 26. Na ocasião, o legista concluiu que a morte ocorreu logo após a queda, no próprio dia 21, em razão de um traumatismo grave. No entanto, imagens de drones captadas por turistas levantaram dúvidas sobre essa versão e indicam que Juliana poderia ter sobrevivido por mais tempo, sem socorro adequado.

A certidão de óbito emitida pela Embaixada do Brasil em Jacarta não esclareceu o momento exato da morte, o que levou a DPU a solicitar a realização de um novo exame pericial no país.

'Colaborar com celeridade e efetividade', diz AGU

O procurador-regional da União da 2ª Região, Glaucio de Lima e Castro, afirmou que o governo federal acompanha o caso desde o início, com atenção e solidariedade. Segundo ele, a decisão de antecipar o cumprimento do pedido da Defensoria tem caráter humanitário.

“Devido à natureza da demanda, compreendeu-se que a postura mais adequada seria a de colaborar para que as providências solicitadas pudessem ser operacionalizadas com celeridade e efetividade”, disse.

A AGU solicitou uma audiência de urgência com a DPU e o governo do Rio de Janeiro para definir as responsabilidades de cada ente federativo. A Polícia Federal já informou que pode colaborar com o traslado do corpo até o Instituto Médico Legal (IML) que for designado.

Dúvida sobre omissão de socorro

A principal dúvida em torno do caso é se houve omissão de socorro por parte das autoridades indonésias, o que poderia levar à responsabilização civil e criminal.

O corpo de Juliana foi retirado da região do vulcão apenas no dia 24, três dias após o acidente. A nova autópsia no Brasil deve esclarecer se ela morreu imediatamente após a queda ou se resistiu por algum tempo sem atendimento.",Márcio Falcão,30/06/2025 18h46,https://g1.globo.com/politica/noticia/2025/06/30/governo-brasileiro-atende-pedido-e-corpo-de-juliana-marins-passara-por-nova-autopsia.ghtml